description,sentence_context,phrase_type,language,location,osm_tag_key,osm_tag_value,source,coordinates,extracted_at,cleaned_description,adjective_noun_patterns,description_length,word_count,pattern_count
the modern century,"The village is filled with an authenticity, that the modern century and the Hindu historical places to wander around the stairs and streets for great outdoor walking.",adjective_noun,English,Islamabad,nan,nan,https://travelpakistani.com/blogs/top-10-most-beautiful-places-in-islamabad-2024/125,"[73.0479, 33.6844]",2025-07-30T07:56:06.094656,modern century,['modern_century'],14,2,1
the ancient artwork,"When you enter this village, you will be awed by the ancient artwork and enjoy the traditional lifestyle of the residents where they play the sitars on the streets.",adjective_noun,English,Islamabad,nan,nan,https://travelpakistani.com/blogs/top-10-most-beautiful-places-in-islamabad-2024/125,"[73.0479, 33.6844]",2025-07-30T07:56:06.094656,ancient artwork,[],15,2,0
a national monument,5) Pakistan Monument The Pakistan Monument is a national monument and museum located on the western Shakarparian Hills in the capital territory.,adjective_noun,English,Islamabad,nan,nan,https://travelpakistani.com/blogs/top-10-most-beautiful-places-in-islamabad-2024/125,"[73.0479, 33.6844]",2025-07-30T07:56:06.094656,national monument,['national_monument'],17,2,1
the best places,It is among the best places to visit in Islamabad where you can enjoy the stunning monument of the nation.,adjective_noun,English,Islamabad,nan,nan,https://travelpakistani.com/blogs/top-10-most-beautiful-places-in-islamabad-2024/125,"[73.0479, 33.6844]",2025-07-30T07:56:06.094656,best place,['best_places'],10,2,1
a patriotic structure,The place comprises a patio foundation that has been made of marble adding a patriotic structure to allow a bird-like view of the capital.,adjective_noun,English,Islamabad,nan,nan,https://travelpakistani.com/blogs/top-10-most-beautiful-places-in-islamabad-2024/125,"[73.0479, 33.6844]",2025-07-30T07:56:06.094656,patriotic structure,['patriotic_structure'],19,2,1
shaped structure,The place is inspired by the petal-shaped structure called Muqarnas which was taken from the Mughal era.,adjective_noun,English,Islamabad,nan,nan,https://travelpakistani.com/blogs/top-10-most-beautiful-places-in-islamabad-2024/125,"[73.0479, 33.6844]",2025-07-30T07:56:06.094656,shaped structure,['shaped_structure'],16,2,1
a historic village,"Shah Allah Ditta Caves Shah Allah Ditta Caves are located in Shah Allah Ditta, a historic village at the foot of Margalla Hills in Islamabad which is thousands of years old.",adjective_noun,English,Islamabad,nan,nan,https://travelpakistani.com/blogs/top-10-most-beautiful-places-in-islamabad-2024/125,"[73.0479, 33.6844]",2025-07-30T07:56:06.094656,historic village,['historic_village'],16,2,1
Buddhist impressions,"The caves here are twenty-four hundred years old, and there are Buddhist impressions that these caves are disappearing with time.",adjective_noun,English,Islamabad,nan,nan,https://travelpakistani.com/blogs/top-10-most-beautiful-places-in-islamabad-2024/125,"[73.0479, 33.6844]",2025-07-30T07:56:06.094656,buddhist impression,[],19,2,0
great personalities,It is said that great personalities passed through here and it was also used for this inn.,adjective_noun,English,Islamabad,nan,nan,https://travelpakistani.com/blogs/top-10-most-beautiful-places-in-islamabad-2024/125,"[73.0479, 33.6844]",2025-07-30T07:56:06.094656,great personality,['great_personalities'],17,2,1
the natural beauty,Tourists love the natural beauty of this place as well.,adjective_noun,English,Islamabad,nan,nan,https://travelpakistani.com/blogs/top-10-most-beautiful-places-in-islamabad-2024/125,"[73.0479, 33.6844]",2025-07-30T07:56:06.094656,natural beauty,['natural_beauty'],14,2,1
largest birdcage,This park contains the third-largest birdcage in the world .,adjective_noun,English,Islamabad,nan,nan,https://travelpakistani.com/blogs/top-10-most-beautiful-places-in-islamabad-2024/125,"[73.0479, 33.6844]",2025-07-30T07:56:06.094656,largest birdcage,['largest_birdcage'],16,2,1
other sources,Passenger road trains and motorboats are other sources of entertainment.,adjective_noun,English,Islamabad,nan,nan,https://travelpakistani.com/blogs/top-10-most-beautiful-places-in-islamabad-2024/125,"[73.0479, 33.6844]",2025-07-30T07:56:06.094656,source,[],6,1,0
different locations,"Furthermore, eight hiking trails start from different locations in the forest of Margalla Hills.",adjective_noun,English,Islamabad,nan,nan,https://travelpakistani.com/blogs/top-10-most-beautiful-places-in-islamabad-2024/125,"[73.0479, 33.6844]",2025-07-30T07:56:06.094656,different location,['different_locations'],18,2,1
green trees,"These trails are completely covered with green trees, plants, and rocks.",adjective_noun,English,Islamabad,nan,nan,https://travelpakistani.com/blogs/top-10-most-beautiful-places-in-islamabad-2024/125,"[73.0479, 33.6844]",2025-07-30T07:56:06.094656,green tree,['green_trees'],10,2,1
The natural habitat,The natural habitat for various birds and animals is eye-catching for tourists.,adjective_noun,English,Islamabad,nan,nan,https://travelpakistani.com/blogs/top-10-most-beautiful-places-in-islamabad-2024/125,"[73.0479, 33.6844]",2025-07-30T07:56:06.094656,natural habitat,['natural_habitat'],15,2,1
old trails,Trail numbers 3 and 5 are the most famous old trails in Islamabad.,adjective_noun,English,Islamabad,nan,nan,https://travelpakistani.com/blogs/top-10-most-beautiful-places-in-islamabad-2024/125,"[73.0479, 33.6844]",2025-07-30T07:56:06.094656,old trail,['old_trails'],9,2,1
a beautiful insight,They provide a beautiful insight into the city as well.,adjective_noun,English,Islamabad,nan,nan,https://travelpakistani.com/blogs/top-10-most-beautiful-places-in-islamabad-2024/125,"[73.0479, 33.6844]",2025-07-30T07:56:06.094656,beautiful insight,['beautiful_insight'],17,2,1
important tourist,"9) Pakistan Army Museum The Pakistan Army Museum is one of the most important tourist places in Islamabad, which includes prehistoric artifacts.",adjective_noun,English,Islamabad,nan,nan,https://travelpakistani.com/blogs/top-10-most-beautiful-places-in-islamabad-2024/125,"[73.0479, 33.6844]",2025-07-30T07:56:06.094656,important tourist,['important_tourist'],17,2,1
an ancient country,"It contains exhibition halls that show the history of an ancient country for thousands of years to the present day, from guns, and swords, to the Russian missile system everything related to the army is there for you.",adjective_noun,English,Islamabad,nan,nan,https://travelpakistani.com/blogs/top-10-most-beautiful-places-in-islamabad-2024/125,"[73.0479, 33.6844]",2025-07-30T07:56:06.094656,ancient country,['ancient_country'],15,2,1
national park,This park is the largest national park in Pakistan and covers an area of about 2300 acres.,adjective_noun,English,Islamabad,nan,nan,https://travelpakistani.com/blogs/top-10-most-beautiful-places-in-islamabad-2024/125,"[73.0479, 33.6844]",2025-07-30T07:56:06.094656,national park,['national_park'],13,2,1
a rare collection,"The park hosts Jungle Kingdom – an amusement park for kids with a rare collection of beautiful animals and birds, kept in open-air areas.",adjective_noun,English,Islamabad,nan,nan,https://travelpakistani.com/blogs/top-10-most-beautiful-places-in-islamabad-2024/125,"[73.0479, 33.6844]",2025-07-30T07:56:06.094656,rare collection,['rare_collection'],15,2,1
interesting rides,There are a lot of interesting rides for the kids and the grown-ups in the Jungle Kingdom.,adjective_noun,English,Islamabad,nan,nan,https://travelpakistani.com/blogs/top-10-most-beautiful-places-in-islamabad-2024/125,"[73.0479, 33.6844]",2025-07-30T07:56:06.094656,interesting ride,[],16,2,0
large gardens,"Besides this, Ayub Park also housed large gardens, a running lake with a boating facility, an open-air theater, and a garden restaurant.",adjective_noun,English,Islamabad,nan,nan,https://travelpakistani.com/blogs/top-10-most-beautiful-places-in-islamabad-2024/125,"[73.0479, 33.6844]",2025-07-30T07:56:06.094656,large garden,['large_gardens'],12,2,1
rare botany,The park is also indigenous to rare botany and marine life.,adjective_noun,English,Islamabad,nan,nan,https://travelpakistani.com/blogs/top-10-most-beautiful-places-in-islamabad-2024/125,"[73.0479, 33.6844]",2025-07-30T07:56:06.094656,rare botany,['rare_botany'],11,2,1
an aquarium home,There is an aquarium home to various rare fish and other marine life.,adjective_noun,English,Islamabad,nan,nan,https://travelpakistani.com/blogs/top-10-most-beautiful-places-in-islamabad-2024/125,"[73.0479, 33.6844]",2025-07-30T07:56:06.094656,aquarium home,[],13,2,0
beautiful water,The lake found in the park has water lilies and other beautiful water plants.,adjective_noun,English,Islamabad,nan,nan,https://travelpakistani.com/blogs/top-10-most-beautiful-places-in-islamabad-2024/125,"[73.0479, 33.6844]",2025-07-30T07:56:06.094656,beautiful water,['beautiful_water'],15,2,1
major leaders,The park also includes a carving of all of Pakistan’s major leaders and heroes.,adjective_noun,English,Islamabad,nan,nan,https://travelpakistani.com/blogs/top-10-most-beautiful-places-in-islamabad-2024/125,"[73.0479, 33.6844]",2025-07-30T07:56:06.094656,major leader,['major_leaders'],12,2,1
the gorgeous capital,"Read also: Lok Mela Islamabad Saidpur Village - Islamabad Shah Allah Ditta Caves - Islamabad Top 5 Best Free Activities in Islamabad 2024-2 5 Panjpeer Rocks - Kotli Sattian, Islamabad 5 Breathtaking Waterfalls Near Islamabad World's Second Most Beautiful Capital - Islamabad Natural Swimming Spots Near Islamabad - Pakistan Islamabad, the gorgeous capital of Pakistan, is known for its exceptional beauty, peaceful ambiance, and high quality of life.",adjective_noun,English,Islamabad,nan,nan,https://travelpakistani.com/blogs/top-10-most-beautiful-places-in-islamabad-2024/125,"[73.0479, 33.6844]",2025-07-30T07:56:06.094656,gorgeous capital,['gorgeous_capital'],16,2,1
a likely chance,"If you are planning to travel to Pakistan, there is a likely chance that you will be passing through Islamabad, especially if you are planning to travel to the north where adventure awaits.",adjective_noun,English,Islamabad,nan,nan,https://www.bucketlistly.blog/posts/6-best-places-visit-things-to-do-islamabad-pakistan,"[73.0479, 33.6844]",2025-07-30T07:56:06.095655,likely chance,['likely_chance'],13,2,1
amazing things,"Without further ado, here is a guide on amazing things to do in Islamabad.",adjective_noun,English,Islamabad,nan,nan,https://www.bucketlistly.blog/posts/6-best-places-visit-things-to-do-islamabad-pakistan,"[73.0479, 33.6844]",2025-07-30T07:56:06.095655,amazing thing,['amazing_things'],13,2,1
Best Things,6 Best Things to Do in Islamabad 1.,adjective_noun,English,Islamabad,nan,nan,https://www.bucketlistly.blog/posts/6-best-places-visit-things-to-do-islamabad-pakistan,"[73.0479, 33.6844]",2025-07-30T07:56:06.095655,best thing,['best_things'],10,2,1
a spacious park,"The monument is built on top of a hill in a spacious park, and by being there early in the morning, you will have the whole place to yourself, so you can walk around at your own leisure.",adjective_noun,English,Islamabad,nan,nan,https://www.bucketlistly.blog/posts/6-best-places-visit-things-to-do-islamabad-pakistan,"[73.0479, 33.6844]",2025-07-30T07:56:06.095655,spacious park,['spacious_park'],13,2,1
several vans,"By the time I left around 10:30 AM, several vans were dropping off local tourists.",adjective_noun,English,Islamabad,nan,nan,https://www.bucketlistly.blog/posts/6-best-places-visit-things-to-do-islamabad-pakistan,"[73.0479, 33.6844]",2025-07-30T07:56:06.095655,several van,['several_vans'],11,2,1
a few minutes,"Best Museum Only a few minutes' walk away from the Pakistan Monument, you will find the Lok Virsa Heritage Museum, a great modern museum of history, art, and culture of Pakistan and other Central Asian countries.",adjective_noun,English,Islamabad,nan,nan,https://www.bucketlistly.blog/posts/6-best-places-visit-things-to-do-islamabad-pakistan,"[73.0479, 33.6844]",2025-07-30T07:56:06.095655,minute,[],6,1,0
indoor exhibitions,"The museum consists of both outdoor and indoor exhibitions, ranging from a collection of displays showcasing the vibrant and diverse cultures of Pakistan from different areas to allowing you to listen to recordings of traditional music and watch several locally-produced cultural documentaries.",adjective_noun,English,Islamabad,nan,nan,https://www.bucketlistly.blog/posts/6-best-places-visit-things-to-do-islamabad-pakistan,"[73.0479, 33.6844]",2025-07-30T07:56:06.095655,indoor exhibition,['indoor_exhibitions'],17,2,1
no better place,There is no better place to learn about Pakistan than at the Lok Virsa Museum.,adjective_noun,English,Islamabad,nan,nan,https://www.bucketlistly.blog/posts/6-best-places-visit-things-to-do-islamabad-pakistan,"[73.0479, 33.6844]",2025-07-30T07:56:06.095655,better,[],6,1,0
conservative country,"Pakistan, from the outside, is a very conservative country, and when you walk around a city like Lahore or Rawalpindi, you might forget that there is also a modern side to this country, and it is best seen in a place like the Centaurus Mall.",adjective_noun,English,Islamabad,nan,nan,https://www.bucketlistly.blog/posts/6-best-places-visit-things-to-do-islamabad-pakistan,"[73.0479, 33.6844]",2025-07-30T07:56:06.095655,conservative country,['conservative_country'],20,2,1
Western food,"Also, they have a food court full of both local and Western food chains that will indulge you for days.",adjective_noun,English,Islamabad,nan,nan,https://www.bucketlistly.blog/posts/6-best-places-visit-things-to-do-islamabad-pakistan,"[73.0479, 33.6844]",2025-07-30T07:56:06.095655,western food,['western_food'],12,2,1
the best naan,I had the best naan sandwich here.,adjective_noun,English,Islamabad,nan,nan,https://www.bucketlistly.blog/posts/6-best-places-visit-things-to-do-islamabad-pakistan,"[73.0479, 33.6844]",2025-07-30T07:56:06.095655,best naan,['best_naan'],9,2,1
more activities,"Tours & Tickets You Might Like If you are looking for more activities to do here, be sure to check out some of the available tours and day trips : From Islamabad:",adjective_noun,English,Islamabad,nan,nan,https://www.bucketlistly.blog/posts/6-best-places-visit-things-to-do-islamabad-pakistan,"[73.0479, 33.6844]",2025-07-30T07:56:06.095655,activity,[],8,1,0
Koh viewpoint,"Full Day Historical Peshawar Guided City Tour (8 to 10 hours) Full-Day Sightseeing Tour Of Islamabad (5 to 6 hours) Islamabad International Airport Arrival Pick up Transfer (1 hour) 4. Check out the Daman-e-Koh Viewpoint ❤️ Must Visit At around 3 PM, when the light is just perfect, take an Uber up to the Daman-e-Koh viewpoint, where you will be able to see why they call Islamabad the greenest city in the country.",adjective_noun,English,Islamabad,nan,nan,https://www.bucketlistly.blog/posts/6-best-places-visit-things-to-do-islamabad-pakistan,"[73.0479, 33.6844]",2025-07-30T07:56:06.095655,koh viewpoint,[],13,2,0
no better view,There is no better view of the city than this.,adjective_noun,English,Islamabad,nan,nan,https://www.bucketlistly.blog/posts/6-best-places-visit-things-to-do-islamabad-pakistan,"[73.0479, 33.6844]",2025-07-30T07:56:06.095655,better view,['better_view'],11,2,1
a small carnival,"If you are there on a Sunday, you will also be greeted with a small carnival-like market full of snacks and small amusement rides such as bouncing castles and spinning teacups, as well as lots and lots of locals enjoying themselves and having fun with their families.",adjective_noun,English,Islamabad,nan,nan,https://www.bucketlistly.blog/posts/6-best-places-visit-things-to-do-islamabad-pakistan,"[73.0479, 33.6844]",2025-07-30T07:56:06.095655,small carnival,['small_carnival'],14,2,1
good reason,"6. Visit the Faisal Mosque during Sunset ❤️ Must Visit Faisal Mosque is one of the most well-known landmarks in Islamabad, and for good reason.",adjective_noun,English,Islamabad,nan,nan,https://www.bucketlistly.blog/posts/6-best-places-visit-things-to-do-islamabad-pakistan,"[73.0479, 33.6844]",2025-07-30T07:56:06.095655,good reason,['good_reason'],11,2,1
the typical dome,"The design of the mosque is very unique, with the structure shaped like a Bedouin tent instead of the typical dome-shaped exterior found in most mosques around the world.",adjective_noun,English,Islamabad,nan,nan,https://www.bucketlistly.blog/posts/6-best-places-visit-things-to-do-islamabad-pakistan,"[73.0479, 33.6844]",2025-07-30T07:56:06.095655,typical dome,['typical_dome'],12,2,1
the natural light,"The structure is impressive, but even more so right after sunset as the natural light subsides and the artificial light takes over, illuminating the structure with an orange hue.",adjective_noun,English,Islamabad,nan,nan,https://www.bucketlistly.blog/posts/6-best-places-visit-things-to-do-islamabad-pakistan,"[73.0479, 33.6844]",2025-07-30T07:56:06.095655,natural light,['natural_light'],13,2,1
spiritual moments,It was one of the most spiritual moments in Pakistan.,adjective_noun,English,Islamabad,nan,nan,https://www.bucketlistly.blog/posts/6-best-places-visit-things-to-do-islamabad-pakistan,"[73.0479, 33.6844]",2025-07-30T07:56:06.095655,spiritual moment,['spiritual_moments'],16,2,1
Pakistani city,Understanding Islamabad Islamabad is the model of what a modern Pakistani city should look like.,adjective_noun,English,Islamabad,nan,nan,https://www.bucketlistly.blog/posts/6-best-places-visit-things-to-do-islamabad-pakistan,"[73.0479, 33.6844]",2025-07-30T07:56:06.095655,pakistani city,['pakistani_city'],14,2,1
a vast network,"Clusters of buildings are divided into zones, laid out as a grid with a vast network of roads connecting them all together like a spiderweb.",adjective_noun,English,Islamabad,nan,nan,https://www.bucketlistly.blog/posts/6-best-places-visit-things-to-do-islamabad-pakistan,"[73.0479, 33.6844]",2025-07-30T07:56:06.095655,vast network,['vast_network'],12,2,1
green vegetation,"In between the buildings, green vegetation is sprinkled all over the city, making it the greenest city in the country.",adjective_noun,English,Islamabad,nan,nan,https://www.bucketlistly.blog/posts/6-best-places-visit-things-to-do-islamabad-pakistan,"[73.0479, 33.6844]",2025-07-30T07:56:06.095655,green vegetation,['green_vegetation'],16,2,1
loud noises,"Rickshaws are banned due to loud noises, and the streets are as clean as day.",adjective_noun,English,Islamabad,nan,nan,https://www.bucketlistly.blog/posts/6-best-places-visit-things-to-do-islamabad-pakistan,"[73.0479, 33.6844]",2025-07-30T07:56:06.095655,loud noise,['loud_noises'],10,2,1
twin sister,"Islamabad also has an ugly twin sister city called Rawalpindi, which is situated next to it.",adjective_noun,English,Islamabad,nan,nan,https://www.bucketlistly.blog/posts/6-best-places-visit-things-to-do-islamabad-pakistan,"[73.0479, 33.6844]",2025-07-30T07:56:06.095655,twin sister,[],11,2,0
an old city,Rawalpindi is an old city that is the polar opposite of Islamabad.,adjective_noun,English,Islamabad,nan,nan,https://www.bucketlistly.blog/posts/6-best-places-visit-things-to-do-islamabad-pakistan,"[73.0479, 33.6844]",2025-07-30T07:56:06.095655,old city,['old_city'],8,2,1
terrible traffic,"It's loud, dirty, with terrible traffic, and unorganized.",adjective_noun,English,Islamabad,nan,nan,https://www.bucketlistly.blog/posts/6-best-places-visit-things-to-do-islamabad-pakistan,"[73.0479, 33.6844]",2025-07-30T07:56:06.095655,terrible traffic,['terrible_traffic'],16,2,1
a calmer experience,"If you want a calmer experience, I would recommend avoiding accommodation in Rawalpindi.",adjective_noun,English,Islamabad,nan,nan,https://www.bucketlistly.blog/posts/6-best-places-visit-things-to-do-islamabad-pakistan,"[73.0479, 33.6844]",2025-07-30T07:56:06.095655,calmer experience,[],17,2,0
a big difference,"Also, be sure that the accommodation you booked is really in Islamabad and not Rawalpindi because that makes a big difference.",adjective_noun,English,Islamabad,nan,nan,https://www.bucketlistly.blog/posts/6-best-places-visit-things-to-do-islamabad-pakistan,"[73.0479, 33.6844]",2025-07-30T07:56:06.095655,big difference,['big_difference'],14,2,1
good times,"September and October are also good times if you are planning to go to the north and do some hiking, as the weather is mostly calm and the colors of autumn are in full swing.",adjective_noun,English,Islamabad,nan,nan,https://www.bucketlistly.blog/posts/6-best-places-visit-things-to-do-islamabad-pakistan,"[73.0479, 33.6844]",2025-07-30T07:56:06.095655,good time,['good_times'],9,2,1
daily budgets,"Please keep in mind that these are suggested daily budgets based on my own style of travel, which leans more towards the budget side of things.",adjective_noun,English,Islamabad,nan,nan,https://www.bucketlistly.blog/posts/6-best-places-visit-things-to-do-islamabad-pakistan,"[73.0479, 33.6844]",2025-07-30T07:56:06.095655,daily budget,['daily_budgets'],12,2,1
convenient modes,"If you aim to stick to this budget, anticipate sleeping in dormitories, dining out only occasionally, and being comfortable with the cheapest and most convenient modes of transportation, which often involve a considerable amount of walking.",adjective_noun,English,Islamabad,nan,nan,https://www.bucketlistly.blog/posts/6-best-places-visit-things-to-do-islamabad-pakistan,"[73.0479, 33.6844]",2025-07-30T07:56:06.095655,convenient mode,[],15,2,0
a global eSIM,"Update: If your phone supports eSIM, I highly recommend checking out Airalo , a global eSIM marketplace.",adjective_noun,English,Islamabad,nan,nan,https://www.bucketlistly.blog/posts/6-best-places-visit-things-to-do-islamabad-pakistan,"[73.0479, 33.6844]",2025-07-30T07:56:06.095655,global esim,['global_esim'],11,2,1
a local SIM,Gone are the days when you needed to scramble to find a local SIM card at an airport upon arrival.,adjective_noun,English,Islamabad,nan,nan,https://www.bucketlistly.blog/posts/6-best-places-visit-things-to-do-islamabad-pakistan,"[73.0479, 33.6844]",2025-07-30T07:56:06.095655,local sim,['local_sim'],9,2,1
The entire process,The entire process took me less than 5 minutes.,adjective_noun,English,Islamabad,nan,nan,https://www.bucketlistly.blog/posts/6-best-places-visit-things-to-do-islamabad-pakistan,"[73.0479, 33.6844]",2025-07-30T07:56:06.095655,entire process,['entire_process'],14,2,1
certain countries,"It's FREE , and you can gain access to services that may be blocked in certain countries.",adjective_noun,English,Islamabad,nan,nan,https://www.bucketlistly.blog/posts/6-best-places-visit-things-to-do-islamabad-pakistan,"[73.0479, 33.6844]",2025-07-30T07:56:06.095655,certain country,['certain_countries'],15,2,1
light traveling,"As you may already know, I am an advocate of light traveling, and indeed, packing light for a journey like this is a unique art form.",adjective_noun,English,Islamabad,nan,nan,https://www.bucketlistly.blog/posts/6-best-places-visit-things-to-do-islamabad-pakistan,"[73.0479, 33.6844]",2025-07-30T07:56:06.095655,light traveling,[],15,2,0
upcoming trip,"Here are some packing tips for your upcoming trip to Islamabad, Pakistan:",adjective_noun,English,Islamabad,nan,nan,https://www.bucketlistly.blog/posts/6-best-places-visit-things-to-do-islamabad-pakistan,"[73.0479, 33.6844]",2025-07-30T07:56:06.095655,upcoming trip,['upcoming_trip'],13,2,1
possible hiking,"Walking/Hiking Shoes : With all the walking and possible hiking during your travel, a comfortable pair of shoes is a must.",adjective_noun,English,Islamabad,nan,nan,https://www.bucketlistly.blog/posts/6-best-places-visit-things-to-do-islamabad-pakistan,"[73.0479, 33.6844]",2025-07-30T07:56:06.095655,possible hiking,['possible_hiking'],15,2,1
long strolls,I recommend the Timberland 3-Eye Classic Boat Shoes that are my go-to pair for long strolls and hikes.,adjective_noun,English,Islamabad,nan,nan,https://www.bucketlistly.blog/posts/6-best-places-visit-things-to-do-islamabad-pakistan,"[73.0479, 33.6844]",2025-07-30T07:56:06.095655,long stroll,[],11,2,0
Breathable Shirts,"Breathable Shirts : Given the potential for hot weather, pack a few breathable shirts for your outdoor adventures.",adjective_noun,English,Islamabad,nan,nan,https://www.bucketlistly.blog/posts/6-best-places-visit-things-to-do-islamabad-pakistan,"[73.0479, 33.6844]",2025-07-30T07:56:06.095655,breathable shirt,['breathable_shirts'],16,2,1
some breathable shorts,Be sure to pack some breathable shorts and a pair of Levi's jeans for when the weather cools.,adjective_noun,English,Islamabad,nan,nan,https://www.bucketlistly.blog/posts/6-best-places-visit-things-to-do-islamabad-pakistan,"[73.0479, 33.6844]",2025-07-30T07:56:06.095655,breathable short,['breathable_shorts'],16,2,1
cold climates,"For women, leggings are excellent for both hot and cold climates, so consider packing some as well.",adjective_noun,English,Islamabad,nan,nan,https://www.bucketlistly.blog/posts/6-best-places-visit-things-to-do-islamabad-pakistan,"[73.0479, 33.6844]",2025-07-30T07:56:06.095655,cold climate,[],12,2,0
colder weather,"Fleece Jacket : For colder weather, layering is the key, and a fleece jacket makes an excellent insulating layer.",adjective_noun,English,Islamabad,nan,nan,https://www.bucketlistly.blog/posts/6-best-places-visit-things-to-do-islamabad-pakistan,"[73.0479, 33.6844]",2025-07-30T07:56:06.095655,colder weather,[],14,2,0
An outer shell,Outer Shell Jacket : An outer shell jacket is great for windy or rainy conditions.,adjective_noun,English,Islamabad,nan,nan,https://www.bucketlistly.blog/posts/6-best-places-visit-things-to-do-islamabad-pakistan,"[73.0479, 33.6844]",2025-07-30T07:56:06.095655,outer shell,[],11,2,0
