description,sentence_context,phrase_type,language,location,osm_tag_key,osm_tag_value,source,coordinates,extracted_at,cleaned_description,adjective_noun_patterns,description_length,word_count,pattern_count
the northern part,"Some people might want to skip the city and jump into their adventure trips to explore the northern part of Pakistan or other parts of the country, but I would recommend you not to do so.",adjective_noun,English,Islamabad,nan,nan,https://travelwithmansoureh.com/blog/travel-guide-places-to-visit-in-islamabad-and-things-to-do,"[73.0479, 33.6844]",2025-07-30T07:56:06.093655,northern part,['northern_part'],13,2,1
any other capital,Islamabad is not just like any other capital cities in the world.,adjective_noun,English,Islamabad,nan,nan,https://travelwithmansoureh.com/blog/travel-guide-places-to-visit-in-islamabad-and-things-to-do,"[73.0479, 33.6844]",2025-07-30T07:56:06.093655,capital,[],7,1,0
other cities,The city is unique and it is very different from other cities in Pakistan.,adjective_noun,English,Islamabad,nan,nan,https://travelwithmansoureh.com/blog/travel-guide-places-to-visit-in-islamabad-and-things-to-do,"[73.0479, 33.6844]",2025-07-30T07:56:06.093655,city,[],4,1,0
beautiful places,There are a lot of things to do and beautiful places to visit in and around Islamabad.,adjective_noun,English,Islamabad,nan,nan,https://travelwithmansoureh.com/blog/travel-guide-places-to-visit-in-islamabad-and-things-to-do,"[73.0479, 33.6844]",2025-07-30T07:56:06.093655,beautiful place,['beautiful_places'],15,2,1
the best time,When is the best time to travel to Islamabad?,adjective_noun,English,Islamabad,nan,nan,https://travelwithmansoureh.com/blog/travel-guide-places-to-visit-in-islamabad-and-things-to-do,"[73.0479, 33.6844]",2025-07-30T07:56:06.093655,best time,['best_time'],9,2,1
the hottest time,Mid-July is considered the hottest time of the year when the temperature can fluctuate around 40°C.,adjective_noun,English,Islamabad,nan,nan,https://travelwithmansoureh.com/blog/travel-guide-places-to-visit-in-islamabad-and-things-to-do,"[73.0479, 33.6844]",2025-07-30T07:56:06.093655,hottest time,['hottest_time'],12,2,1
the hot seasons,"It is best to avoid travelling to Pakistan during the hot seasons, especially if you are planning to go to the centre of the country or the southern areas.",adjective_noun,English,Islamabad,nan,nan,https://travelwithmansoureh.com/blog/travel-guide-places-to-visit-in-islamabad-and-things-to-do,"[73.0479, 33.6844]",2025-07-30T07:56:06.093655,hot season,['hot_seasons'],10,2,1
Many tourists,Many tourists prefer to travel to Islamabad between September and October or between March and April when the weather cools down and it is more comfortable to be outside.,adjective_noun,English,Islamabad,nan,nan,https://travelwithmansoureh.com/blog/travel-guide-places-to-visit-in-islamabad-and-things-to-do,"[73.0479, 33.6844]",2025-07-30T07:56:06.093655,many tourist,['many_tourists'],12,2,1
the best months,"Moreover, these months are considered the best months to travel to the mountains in the northern parts of the country.",adjective_noun,English,Islamabad,nan,nan,https://travelwithmansoureh.com/blog/travel-guide-places-to-visit-in-islamabad-and-things-to-do,"[73.0479, 33.6844]",2025-07-30T07:56:06.093655,best month,['best_months'],10,2,1
green city,Where to stay in Islamabad Islamabad is a lush green city with a population just below 1.9 million people.,adjective_noun,English,Islamabad,nan,nan,https://travelwithmansoureh.com/blog/travel-guide-places-to-visit-in-islamabad-and-things-to-do,"[73.0479, 33.6844]",2025-07-30T07:56:06.093655,green city,['green_city'],10,2,1
a single city,This city doesn’t have a single city centre.,adjective_noun,English,Islamabad,nan,nan,https://travelwithmansoureh.com/blog/travel-guide-places-to-visit-in-islamabad-and-things-to-do,"[73.0479, 33.6844]",2025-07-30T07:56:06.093655,single city,['single_city'],11,2,1
various areas,"You will find a variety of shops and restaurants in various areas, but the Blue Area is considered one of the main central locations in the city.",adjective_noun,English,Islamabad,nan,nan,https://travelwithmansoureh.com/blog/travel-guide-places-to-visit-in-islamabad-and-things-to-do,"[73.0479, 33.6844]",2025-07-30T07:56:06.093655,various area,['various_areas'],12,2,1
the main shopping,"If you book anywhere in the sectors G6-G8 or the sectors F6-F8, you will have to walk 20 to 30 minutes or get a taxi to get to the main shopping malls and restaurants in the Blue Area.",adjective_noun,English,Islamabad,nan,nan,https://travelwithmansoureh.com/blog/travel-guide-places-to-visit-in-islamabad-and-things-to-do,"[73.0479, 33.6844]",2025-07-30T07:56:06.093655,main shopping,['main_shopping'],13,2,1
different budgets,There are a variety of options for different budgets.,adjective_noun,English,Islamabad,nan,nan,https://travelwithmansoureh.com/blog/travel-guide-places-to-visit-in-islamabad-and-things-to-do,"[73.0479, 33.6844]",2025-07-30T07:56:06.093655,different budget,['different_budgets'],16,2,1
the other parts,"Keep in mind that accommodation is quite cheap in Pakistan compared to the other parts of the world, and you should be able to book a decent room in a good hotel for less than £50 per night.",adjective_noun,English,Islamabad,nan,nan,https://travelwithmansoureh.com/blog/travel-guide-places-to-visit-in-islamabad-and-things-to-do,"[73.0479, 33.6844]",2025-07-30T07:56:06.093655,part,[],4,1,0
a safe place,"Serai Boutique Hotel in F6, you can book it here Riviera in F8, you can book it here Hill View Hotel in F7, you can book it here Jasmine Inn in G8, you can book it here How to get around Islamabad Islamabad is a safe place to walk around, but you might not be able to find pavements next to every street and crossing some roads could be dangerous.",adjective_noun,English,Islamabad,nan,nan,https://travelwithmansoureh.com/blog/travel-guide-places-to-visit-in-islamabad-and-things-to-do,"[73.0479, 33.6844]",2025-07-30T07:56:06.093655,safe,[],4,1,0
convenient way,Taking a taxi or an Uber is the most convenient way to travel around Islamabad.,adjective_noun,English,Islamabad,nan,nan,https://travelwithmansoureh.com/blog/travel-guide-places-to-visit-in-islamabad-and-things-to-do,"[73.0479, 33.6844]",2025-07-30T07:56:06.093655,convenient way,['convenient_way'],14,2,1
first night,We took a 10-minute taxi ride on our first night in Islamabad and we were clueless about the prices.,adjective_noun,English,Islamabad,nan,nan,https://travelwithmansoureh.com/blog/travel-guide-places-to-visit-in-islamabad-and-things-to-do,"[73.0479, 33.6844]",2025-07-30T07:56:06.093655,first night,[],11,2,0
a fairer price,"Later on, we found out that 150 to 200 Rs was a fairer price for the ride.",adjective_noun,English,Islamabad,nan,nan,https://travelwithmansoureh.com/blog/travel-guide-places-to-visit-in-islamabad-and-things-to-do,"[73.0479, 33.6844]",2025-07-30T07:56:06.093655,fairer price,[],12,2,0
other countries,"In general, buying a SIM card as a foreigner in Pakistan is not as easy as in most other countries.",adjective_noun,English,Islamabad,nan,nan,https://travelwithmansoureh.com/blog/travel-guide-places-to-visit-in-islamabad-and-things-to-do,"[73.0479, 33.6844]",2025-07-30T07:56:06.093655,country,[],7,1,0
local guide,"If you need to be in touch with your local guide or call hotels to book rooms while travelling around the country, you should probably opt for a SIM card that allows you to make calls as well.",adjective_noun,English,Islamabad,nan,nan,https://travelwithmansoureh.com/blog/travel-guide-places-to-visit-in-islamabad-and-things-to-do,"[73.0479, 33.6844]",2025-07-30T07:56:06.093655,local guide,['local_guide'],11,2,1
the largest mosque,"The Shah Faisal Mosque, situated at the foot of the Margalla Hills, is the largest mosque in Pakistan and it holds a special place in the country’s Muslim community.",adjective_noun,English,Islamabad,nan,nan,https://travelwithmansoureh.com/blog/travel-guide-places-to-visit-in-islamabad-and-things-to-do,"[73.0479, 33.6844]",2025-07-30T07:56:06.093655,largest mosque,['largest_mosque'],14,2,1
this unique mosque,"The mosque has been named after Saudi King Faisal, who granted $120 million to Pakistan to build this unique mosque.",adjective_noun,English,Islamabad,nan,nan,https://travelwithmansoureh.com/blog/travel-guide-places-to-visit-in-islamabad-and-things-to-do,"[73.0479, 33.6844]",2025-07-30T07:56:06.093655,unique mosque,['unique_mosque'],13,2,1
main hall,"It can accommodate more than 100,000 worshippers in its main hall and its vast courtyard.",adjective_noun,English,Islamabad,nan,nan,https://travelwithmansoureh.com/blog/travel-guide-places-to-visit-in-islamabad-and-things-to-do,"[73.0479, 33.6844]",2025-07-30T07:56:06.093655,main hall,['main_hall'],9,2,1
this impressive landmark,You should visit this impressive landmark during the sunset to be blown away by its outstanding beauty.,adjective_noun,English,Islamabad,nan,nan,https://travelwithmansoureh.com/blog/travel-guide-places-to-visit-in-islamabad-and-things-to-do,"[73.0479, 33.6844]",2025-07-30T07:56:06.093655,impressive landmark,['impressive_landmark'],19,2,1
a national museum,"The Pakistan Monument The Pakistan Monument, located on the western Shakarparian Hills in Islamabad, is considered a national museum in Pakistan and part of its heritage.",adjective_noun,English,Islamabad,nan,nan,https://travelwithmansoureh.com/blog/travel-guide-places-to-visit-in-islamabad-and-things-to-do,"[73.0479, 33.6844]",2025-07-30T07:56:06.093655,national museum,['national_museum'],15,2,1
This amazing monument,This amazing monument was built as a symbol of unity between people in the country.,adjective_noun,English,Islamabad,nan,nan,https://travelwithmansoureh.com/blog/travel-guide-places-to-visit-in-islamabad-and-things-to-do,"[73.0479, 33.6844]",2025-07-30T07:56:06.093655,amazing monument,['amazing_monument'],16,2,1
the whole monument,"If you want to have the whole monument to yourself, you should visit it in the early morning, before the local tourists arrive.",adjective_noun,English,Islamabad,nan,nan,https://travelwithmansoureh.com/blog/travel-guide-places-to-visit-in-islamabad-and-things-to-do,"[73.0479, 33.6844]",2025-07-30T07:56:06.093655,whole monument,['whole_monument'],14,2,1
some amazing photos,I would recommend you to go there during the sunrise or sunset for taking some amazing photos.,adjective_noun,English,Islamabad,nan,nan,https://travelwithmansoureh.com/blog/travel-guide-places-to-visit-in-islamabad-and-things-to-do,"[73.0479, 33.6844]",2025-07-30T07:56:06.093655,amazing photo,['amazing_photos'],13,2,1
top things,"Centaurus Mall I usually don’t add visiting malls to my top things-to-do list, but here in Islamabad, you should visit the Centaurus Mall, the biggest mall in Pakistan.",adjective_noun,English,Islamabad,nan,nan,https://travelwithmansoureh.com/blog/travel-guide-places-to-visit-in-islamabad-and-things-to-do,"[73.0479, 33.6844]",2025-07-30T07:56:06.093655,top thing,['top_things'],9,2,1
the modern side,The mall is not that huge but it will let you experience the modern side of Pakistan.,adjective_noun,English,Islamabad,nan,nan,https://travelwithmansoureh.com/blog/travel-guide-places-to-visit-in-islamabad-and-things-to-do,"[73.0479, 33.6844]",2025-07-30T07:56:06.093655,modern side,['modern_side'],11,2,1
the best place,"In addition, if you need to buy anything, it is the best place to shop.",adjective_noun,English,Islamabad,nan,nan,https://travelwithmansoureh.com/blog/travel-guide-places-to-visit-in-islamabad-and-things-to-do,"[73.0479, 33.6844]",2025-07-30T07:56:06.093655,best,[],4,1,0
a great place,This mall can be a great place to eat because it hosts some international restaurants and a large food court.,adjective_noun,English,Islamabad,nan,nan,https://travelwithmansoureh.com/blog/travel-guide-places-to-visit-in-islamabad-and-things-to-do,"[73.0479, 33.6844]",2025-07-30T07:56:06.093655,great,[],5,1,0
local dishes,"I always recommend eating local dishes when you travel to a destination, but here is a little different.",adjective_noun,English,Islamabad,nan,nan,https://travelwithmansoureh.com/blog/travel-guide-places-to-visit-in-islamabad-and-things-to-do,"[73.0479, 33.6844]",2025-07-30T07:56:06.093655,local dish,['local_dishes'],10,2,1
the 3rd floor,"We enjoyed eating in La Terrazza (on the 3rd floor), an Italian restaurant, where we had an amazing view of Islamabad and tried some Italian dishes with a Pakistani twist.",adjective_noun,English,Islamabad,nan,nan,https://travelwithmansoureh.com/blog/travel-guide-places-to-visit-in-islamabad-and-things-to-do,"[73.0479, 33.6844]",2025-07-30T07:56:06.093655,3rd floor,[],9,2,0
various walking,There are various walking and hiking trails you can take.,adjective_noun,English,Islamabad,nan,nan,https://travelwithmansoureh.com/blog/travel-guide-places-to-visit-in-islamabad-and-things-to-do,"[73.0479, 33.6844]",2025-07-30T07:56:06.093655,various walking,[],15,2,0
wild boars,"You might see some wildlife such as wild boars, Asian paradise flycatchers and monkeys.",adjective_noun,English,Islamabad,nan,nan,https://travelwithmansoureh.com/blog/travel-guide-places-to-visit-in-islamabad-and-things-to-do,"[73.0479, 33.6844]",2025-07-30T07:56:06.093655,wild boar,['wild_boars'],9,2,1
major bookstores,You can find the trails map in major bookstores in Islamabad.,adjective_noun,English,Islamabad,nan,nan,https://travelwithmansoureh.com/blog/travel-guide-places-to-visit-in-islamabad-and-things-to-do,"[73.0479, 33.6844]",2025-07-30T07:56:06.093655,major bookstore,['major_bookstores'],15,2,1
a short walk,"Some of the trails are good for a short walk, but some of them can take up to three days.",adjective_noun,English,Islamabad,nan,nan,https://travelwithmansoureh.com/blog/travel-guide-places-to-visit-in-islamabad-and-things-to-do,"[73.0479, 33.6844]",2025-07-30T07:56:06.093655,short walk,['short_walk'],10,2,1
Persian words,Daman-E-Koh Viewpoint Daman-E-Koh is a combination of two Persian words and means foothill.,adjective_noun,English,Islamabad,nan,nan,https://travelwithmansoureh.com/blog/travel-guide-places-to-visit-in-islamabad-and-things-to-do,"[73.0479, 33.6844]",2025-07-30T07:56:06.093655,persian word,['persian_words'],12,2,1
a great view,Here you can have a great view overlooking the whole city of Islamabad.,adjective_noun,English,Islamabad,nan,nan,https://travelwithmansoureh.com/blog/travel-guide-places-to-visit-in-islamabad-and-things-to-do,"[73.0479, 33.6844]",2025-07-30T07:56:06.093655,great view,['great_view'],10,2,1
a better look,Daman-E-Koh Viewpoint is where you can have a better look at how green and beautiful Islamabad is.,adjective_noun,English,Islamabad,nan,nan,https://travelwithmansoureh.com/blog/travel-guide-places-to-visit-in-islamabad-and-things-to-do,"[73.0479, 33.6844]",2025-07-30T07:56:06.093655,better look,['better_look'],11,2,1
local families,This place is popular amongst local families and it can get busy in the evening.,adjective_noun,English,Islamabad,nan,nan,https://travelwithmansoureh.com/blog/travel-guide-places-to-visit-in-islamabad-and-things-to-do,"[73.0479, 33.6844]",2025-07-30T07:56:06.093655,local family,['local_families'],12,2,1
wild monkeys,"You should keep an eye on your belongings, especially your phone and your food, because there are many wild monkeys around the park.",adjective_noun,English,Islamabad,nan,nan,https://travelwithmansoureh.com/blog/travel-guide-places-to-visit-in-islamabad-and-things-to-do,"[73.0479, 33.6844]",2025-07-30T07:56:06.093655,wild monkey,['wild_monkeys'],11,2,1
Pakistani food,"Where to eat in Islamabad If you never tried Pakistani food, get ready to gain some weight, because Pakistani dishes are tasty.",adjective_noun,English,Islamabad,nan,nan,https://travelwithmansoureh.com/blog/travel-guide-places-to-visit-in-islamabad-and-things-to-do,"[73.0479, 33.6844]",2025-07-30T07:56:06.093655,pakistani food,[],14,2,0
good restaurants,There are a lot of good restaurants and here I listed some of the best places to eat in Islamabad.,adjective_noun,English,Islamabad,nan,nan,https://travelwithmansoureh.com/blog/travel-guide-places-to-visit-in-islamabad-and-things-to-do,"[73.0479, 33.6844]",2025-07-30T07:56:06.093655,good restaurant,['good_restaurants'],15,2,1
Afghan food,This place is famous for its grilled meat and it serves Afghan food.,adjective_noun,English,Islamabad,nan,nan,https://travelwithmansoureh.com/blog/travel-guide-places-to-visit-in-islamabad-and-things-to-do,"[73.0479, 33.6844]",2025-07-30T07:56:06.093655,afghan food,[],11,2,0
nice restaurant,"Monal Restaurant : If you go further up the hill from Daman-e-Koh, you will find a very nice restaurant with a great view: Monal Restaurant.",adjective_noun,English,Islamabad,nan,nan,https://travelwithmansoureh.com/blog/travel-guide-places-to-visit-in-islamabad-and-things-to-do,"[73.0479, 33.6844]",2025-07-30T07:56:06.093655,nice restaurant,['nice_restaurant'],15,2,1
a soft drink,"You might find this restaurant a bit pricey but one meal or even just a drink (a soft drink, of course) is worth it for the view.",adjective_noun,English,Islamabad,nan,nan,https://travelwithmansoureh.com/blog/travel-guide-places-to-visit-in-islamabad-and-things-to-do,"[73.0479, 33.6844]",2025-07-30T07:56:06.093655,soft drink,['soft_drink'],10,2,1
the busiest street,Rawalpindi Food Street : Rawalpindi is one of the busiest street food markets in Pakistan.,adjective_noun,English,Islamabad,nan,nan,https://travelwithmansoureh.com/blog/travel-guide-places-to-visit-in-islamabad-and-things-to-do,"[73.0479, 33.6844]",2025-07-30T07:56:06.093655,busiest street,['busiest_street'],14,2,1
modern city,Islamabad is the most modern city in Pakistan where most tourists start their trips before going on exploring the country.,adjective_noun,English,Islamabad,nan,nan,https://travelwithmansoureh.com/blog/travel-guide-places-to-visit-in-islamabad-and-things-to-do,"[73.0479, 33.6844]",2025-07-30T07:56:06.093655,modern city,['modern_city'],11,2,1
a great time,"We really enjoyed our time in this city and I hope you have a great time there, too.",adjective_noun,English,Islamabad,nan,nan,https://travelwithmansoureh.com/blog/travel-guide-places-to-visit-in-islamabad-and-things-to-do,"[73.0479, 33.6844]",2025-07-30T07:56:06.093655,great time,['great_time'],10,2,1
a small commission,This post contains affiliate links and if you click one I may receive a small commission at no extra cost to you.,adjective_noun,English,Islamabad,nan,nan,https://travelwithmansoureh.com/blog/travel-guide-places-to-visit-in-islamabad-and-things-to-do,"[73.0479, 33.6844]",2025-07-30T07:56:06.093655,small commission,['small_commission'],16,2,1
the latest stories,Would you like to read the latest stories?,adjective_noun,English,Islamabad,nan,nan,https://travelwithmansoureh.com/blog/travel-guide-places-to-visit-in-islamabad-and-things-to-do,"[73.0479, 33.6844]",2025-07-30T07:56:06.093655,latest story,['latest_stories'],12,2,1
new adventures,We will keep you updated with our new adventures.,adjective_noun,English,Islamabad,nan,nan,https://travelwithmansoureh.com/blog/travel-guide-places-to-visit-in-islamabad-and-things-to-do,"[73.0479, 33.6844]",2025-07-30T07:56:06.093655,new adventure,['new_adventures'],13,2,1
scenic views,"Due to its scenic views and natural beauty, the city is ranked as the second most beautiful capital in the world.",adjective_noun,English,Islamabad,nan,nan,https://travelpakistani.com/blogs/top-10-most-beautiful-places-in-islamabad-2024/125,"[73.0479, 33.6844]",2025-07-30T07:56:06.094656,scenic view,['scenic_views'],11,2,1
amazing sightseeing,"The city has amazing sightseeing spots, contemporary eateries, lush green parks loads of recreational activities spots, and much more .",adjective_noun,English,Islamabad,nan,nan,https://travelpakistani.com/blogs/top-10-most-beautiful-places-in-islamabad-2024/125,"[73.0479, 33.6844]",2025-07-30T07:56:06.094656,amazing sightseeing,[],19,2,0
famous places,The Faisal Mosque is one of the most famous places in Islamabad.,adjective_noun,English,Islamabad,nan,nan,https://travelpakistani.com/blogs/top-10-most-beautiful-places-in-islamabad-2024/125,"[73.0479, 33.6844]",2025-07-30T07:56:06.094656,famous place,['famous_places'],12,2,1
a beautiful view,"Faisal Mosque is in Islamabad, the capital of Pakistan which offers a beautiful view of the Margalla Hills at the far end of Islamabad.",adjective_noun,English,Islamabad,nan,nan,https://travelpakistani.com/blogs/top-10-most-beautiful-places-in-islamabad-2024/125,"[73.0479, 33.6844]",2025-07-30T07:56:06.094656,beautiful view,['beautiful_view'],14,2,1
a total area,The Mosque covers a total area of 5000 square meters or 91984 feet.,adjective_noun,English,Islamabad,nan,nan,https://travelpakistani.com/blogs/top-10-most-beautiful-places-in-islamabad-2024/125,"[73.0479, 33.6844]",2025-07-30T07:56:06.094656,total,[],5,1,0
the best design,The style of construction of this Mosque has been done on the best design and there are 4 minarets on it.,adjective_noun,English,Islamabad,nan,nan,https://travelpakistani.com/blogs/top-10-most-beautiful-places-in-islamabad-2024/125,"[73.0479, 33.6844]",2025-07-30T07:56:06.094656,best design,['best_design'],11,2,1
Turkish architecture,The Mosque reflects modern Turkish architecture.,adjective_noun,English,Islamabad,nan,nan,https://travelpakistani.com/blogs/top-10-most-beautiful-places-in-islamabad-2024/125,"[73.0479, 33.6844]",2025-07-30T07:56:06.094656,turkish architecture,['turkish_architecture'],20,2,1
the best attraction,This Mosque is the best attraction in Islamabad.,adjective_noun,English,Islamabad,nan,nan,https://travelpakistani.com/blogs/top-10-most-beautiful-places-in-islamabad-2024/125,"[73.0479, 33.6844]",2025-07-30T07:56:06.094656,best attraction,['best_attraction'],15,2,1
scenic spot,2) Daman-e-Koh Daman-e-Koh is the most beautiful scenic spot and top hill garden located in the middle of the Margalla Hills.,adjective_noun,English,Islamabad,nan,nan,https://travelpakistani.com/blogs/top-10-most-beautiful-places-in-islamabad-2024/125,"[73.0479, 33.6844]",2025-07-30T07:56:06.094656,scenic,[],6,1,0
a popular destination,It is a popular destination for residents and visitors to the capital.,adjective_noun,English,Islamabad,nan,nan,https://travelpakistani.com/blogs/top-10-most-beautiful-places-in-islamabad-2024/125,"[73.0479, 33.6844]",2025-07-30T07:56:06.094656,popular destination,['popular_destination'],19,2,1
a common sight,Monkeys are a common sight in winter.,adjective_noun,English,Islamabad,nan,nan,https://travelpakistani.com/blogs/top-10-most-beautiful-places-in-islamabad-2024/125,"[73.0479, 33.6844]",2025-07-30T07:56:06.094656,common sight,['common_sight'],12,2,1
the high hills,"During snowfall, cheetahs often descend from the high hills of Murree.",adjective_noun,English,Islamabad,nan,nan,https://travelpakistani.com/blogs/top-10-most-beautiful-places-in-islamabad-2024/125,"[73.0479, 33.6844]",2025-07-30T07:56:06.094656,high hill,['high_hills'],9,2,1
the highest point,"Daman-e-Koh is the highest point for tourists on the way to Pir Sohawa, a midpoint located at 3600 feet on top of the Margalla Hills.",adjective_noun,English,Islamabad,nan,nan,https://travelpakistani.com/blogs/top-10-most-beautiful-places-in-islamabad-2024/125,"[73.0479, 33.6844]",2025-07-30T07:56:06.094656,highest point,['highest_point'],13,2,1
a beautiful place,3) Lok Virsa Museum The Lok Virsa Museum means “a place of people’s heritage” is a beautiful place to visit in Islamabad.,adjective_noun,English,Islamabad,nan,nan,https://travelpakistani.com/blogs/top-10-most-beautiful-places-in-islamabad-2024/125,"[73.0479, 33.6844]",2025-07-30T07:56:06.094656,beautiful,[],9,1,0
different artifacts,It holds different artifacts to display the history and diversified culture of Pakistan.,adjective_noun,English,Islamabad,nan,nan,https://travelpakistani.com/blogs/top-10-most-beautiful-places-in-islamabad-2024/125,"[73.0479, 33.6844]",2025-07-30T07:56:06.094656,different artifact,['different_artifacts'],18,2,1
a large area,"It covers a large area of about 60,000 square feet, making it the largest museum in Pakistan .",adjective_noun,English,Islamabad,nan,nan,https://travelpakistani.com/blogs/top-10-most-beautiful-places-in-islamabad-2024/125,"[73.0479, 33.6844]",2025-07-30T07:56:06.094656,large,[],5,1,0
several exhibition,"There are several exhibition halls in this extensive museum to display the cultures in the form of statues, poultry, pictorial, and folk music.",adjective_noun,English,Islamabad,nan,nan,https://travelpakistani.com/blogs/top-10-most-beautiful-places-in-islamabad-2024/125,"[73.0479, 33.6844]",2025-07-30T07:56:06.094656,several exhibition,['several_exhibition'],18,2,1
classical melodies,"In addition, Lok Virsa Museum has a collection of books on folk and classical melodies for auction.",adjective_noun,English,Islamabad,nan,nan,https://travelpakistani.com/blogs/top-10-most-beautiful-places-in-islamabad-2024/125,"[73.0479, 33.6844]",2025-07-30T07:56:06.094656,classical melody,['classical_melodies'],16,2,1
the popular picnic,4) Saidpur Village Saidpur Village is one of the highlights of the capital city and is marked as the popular picnic spot in Islamabad.,adjective_noun,English,Islamabad,nan,nan,https://travelpakistani.com/blogs/top-10-most-beautiful-places-in-islamabad-2024/125,"[73.0479, 33.6844]",2025-07-30T07:56:06.094656,popular picnic,['popular_picnic'],14,2,1
an old town,"Saidpur is an old town with great history, located close to Margalla Hills where you can visit the temple and a Sikh Gurdwara to know about the unwrapping history behind this place.",adjective_noun,English,Islamabad,nan,nan,https://travelpakistani.com/blogs/top-10-most-beautiful-places-in-islamabad-2024/125,"[73.0479, 33.6844]",2025-07-30T07:56:06.094656,old town,['old_town'],8,2,1
