description,sentence_context,phrase_type,language,location,osm_tag_key,osm_tag_value,source,coordinates,extracted_at,cleaned_description,adjective_noun_patterns,description_length,word_count,pattern_count
your accommodation,It is good to book your accommodation not too far from the Blue Area.,noun_phrase,English,Islamabad,nan,nan,https://travelwithmansoureh.com/blog/travel-guide-places-to-visit-in-islamabad-and-things-to-do,"[73.0479, 33.6844]",2025-07-30T07:56:06.096655,accommodation,[],13,1,0
Taxis,Taxis in Islamabad don’t have taximeters readers or a fixed price.,noun_phrase,English,Islamabad,nan,nan,https://travelwithmansoureh.com/blog/travel-guide-places-to-visit-in-islamabad-and-things-to-do,"[73.0479, 33.6844]",2025-07-30T07:56:06.096655,taxi,[],4,1,0
your ride,"If your ride is around 10 to 20 minutes, you should pay roughly 150 to 200 Rs.",noun_phrase,English,Islamabad,nan,nan,https://travelwithmansoureh.com/blog/travel-guide-places-to-visit-in-islamabad-and-things-to-do,"[73.0479, 33.6844]",2025-07-30T07:56:06.096655,ride,[],4,1,0
Uber,"Uber is widely used in Islamabad, and it is also very cheap.",noun_phrase,English,Islamabad,nan,nan,https://travelwithmansoureh.com/blog/travel-guide-places-to-visit-in-islamabad-and-things-to-do,"[73.0479, 33.6844]",2025-07-30T07:56:06.096655,uber,[],4,1,0
our experience,Let me share our experience.,noun_phrase,English,Islamabad,nan,nan,https://travelwithmansoureh.com/blog/travel-guide-places-to-visit-in-islamabad-and-things-to-do,"[73.0479, 33.6844]",2025-07-30T07:56:06.096655,experience,[],10,1,0
the taxi driver,"When the taxi driver asked us to pay as much as we wanted, we were honest and told him we just arrived in the city and we had no idea what was fair.",noun_phrase,English,Islamabad,nan,nan,https://travelwithmansoureh.com/blog/travel-guide-places-to-visit-in-islamabad-and-things-to-do,"[73.0479, 33.6844]",2025-07-30T07:56:06.096655,taxi driver,[],11,2,0
1000 Rs,He ended up charging us 1000 Rs.,noun_phrase,English,Islamabad,nan,nan,https://travelwithmansoureh.com/blog/travel-guide-places-to-visit-in-islamabad-and-things-to-do,"[73.0479, 33.6844]",2025-07-30T07:56:06.096655,1000,[],4,1,0
Internet,"Internet and How To Buy SIM Cards in Islamabad Most of the hotels in Islamabad offer free WiFi, but it is not as easy to find reliable WiFi networks in the city.",noun_phrase,English,Islamabad,nan,nan,https://travelwithmansoureh.com/blog/travel-guide-places-to-visit-in-islamabad-and-things-to-do,"[73.0479, 33.6844]",2025-07-30T07:56:06.096655,internet,[],8,1,0
mind,Keep in mind that as a foreigner you can’t buy a SIM card at the airport.,noun_phrase,English,Islamabad,nan,nan,https://travelwithmansoureh.com/blog/travel-guide-places-to-visit-in-islamabad-and-things-to-do,"[73.0479, 33.6844]",2025-07-30T07:56:06.096655,mind,[],4,1,0
Places,Places To Visit in Islamabad and Things To Do Visit the Shah Faisal Mosque,noun_phrase,English,Islamabad,nan,nan,https://travelwithmansoureh.com/blog/travel-guide-places-to-visit-in-islamabad-and-things-to-do,"[73.0479, 33.6844]",2025-07-30T07:56:06.097655,place,[],5,1,0
Margalla Hills Margalla Hills,Hiking in Margalla Hills Margalla Hills is a lush green hill range in the north of Islamabad on the foothills of the Himalaya mountains.,noun_phrase,English,Islamabad,nan,nan,https://travelwithmansoureh.com/blog/travel-guide-places-to-visit-in-islamabad-and-things-to-do,"[73.0479, 33.6844]",2025-07-30T07:56:06.097655,margalla hill margalla hill,[],27,4,0
This park,"This park is located in Margalla Hills, easily reachable by taxi or Uber.",noun_phrase,English,Islamabad,nan,nan,https://travelwithmansoureh.com/blog/travel-guide-places-to-visit-in-islamabad-and-things-to-do,"[73.0479, 33.6844]",2025-07-30T07:56:06.097655,park,[],4,1,0
The food,"The food can be spicy, and if your stomach doesn’t tolerate chilli food make sure to let the restaurant know before ordering.",noun_phrase,English,Islamabad,nan,nan,https://travelwithmansoureh.com/blog/travel-guide-places-to-visit-in-islamabad-and-things-to-do,"[73.0479, 33.6844]",2025-07-30T07:56:06.097655,food,[],4,1,0
Kabul Restaurant,"Kabul Restaurant : Kabul restaurant is located in the sector F7, close to the Safa Gold Mall.",noun_phrase,English,Islamabad,nan,nan,https://travelwithmansoureh.com/blog/travel-guide-places-to-visit-in-islamabad-and-things-to-do,"[73.0479, 33.6844]",2025-07-30T07:56:06.097655,kabul restaurant,[],16,2,0
locals,It is popular amongst locals and suitable for both lunch and dinner.,noun_phrase,English,Islamabad,nan,nan,https://travelwithmansoureh.com/blog/travel-guide-places-to-visit-in-islamabad-and-things-to-do,"[73.0479, 33.6844]",2025-07-30T07:56:06.097655,local,[],5,1,0
less than 20 minutes,It usually takes less than 20 minutes to drive there from Islamabad.,noun_phrase,English,Islamabad,nan,nan,https://travelwithmansoureh.com/blog/travel-guide-places-to-visit-in-islamabad-and-things-to-do,"[73.0479, 33.6844]",2025-07-30T07:56:06.097655,less minute,[],11,2,0
your friends,"If so, share it with your friends Share Tweet Email Hi, I'm Mansoureh Passionate traveller, I take any opportunity to explore the world.",noun_phrase,English,Islamabad,nan,nan,https://travelwithmansoureh.com/blog/travel-guide-places-to-visit-in-islamabad-and-things-to-do,"[73.0479, 33.6844]",2025-07-30T07:56:06.097655,friend,[],6,1,0
my adventures,Here's where I share my adventures.,noun_phrase,English,Islamabad,nan,nan,https://travelwithmansoureh.com/blog/travel-guide-places-to-visit-in-islamabad-and-things-to-do,"[73.0479, 33.6844]",2025-07-30T07:56:06.097655,adventure,[],9,1,0
Instagram,More On Instagram Recommended posts Socialize With Me!,noun_phrase,English,Islamabad,nan,nan,https://travelwithmansoureh.com/blog/travel-guide-places-to-visit-in-islamabad-and-things-to-do,"[73.0479, 33.6844]",2025-07-30T07:56:06.097655,instagram,[],9,1,0
Thanks,Thanks For Subscribing!,noun_phrase,English,Islamabad,nan,nan,https://travelwithmansoureh.com/blog/travel-guide-places-to-visit-in-islamabad-and-things-to-do,"[73.0479, 33.6844]",2025-07-30T07:56:06.097655,thanks,[],6,1,0
Copyright ©,Copyright © 2025 All Right Reserved.,noun_phrase,English,Islamabad,nan,nan,https://travelwithmansoureh.com/blog/travel-guide-places-to-visit-in-islamabad-and-things-to-do,"[73.0479, 33.6844]",2025-07-30T07:56:06.097655,copyright,[],9,1,0
Bruno Filippone,Built by Bruno Filippone,noun_phrase,English,Islamabad,nan,nan,https://travelwithmansoureh.com/blog/travel-guide-places-to-visit-in-islamabad-and-things-to-do,"[73.0479, 33.6844]",2025-07-30T07:56:06.097655,bruno filippone,[],15,2,0
Ayub National Park,Dita Caves Lakeview Park Margalla Hills Pakistan Army Museum Ayub National Park 1) Faisal Mosque,noun_phrase,English,Islamabad,nan,nan,https://travelpakistani.com/blogs/top-10-most-beautiful-places-in-islamabad-2024/125,"[73.0479, 33.6844]",2025-07-30T07:56:06.098655,ayub national park,['national_park'],18,3,1
People,People come from far and wide to see this Mosque.,noun_phrase,English,Islamabad,nan,nan,https://travelpakistani.com/blogs/top-10-most-beautiful-places-in-islamabad-2024/125,"[73.0479, 33.6844]",2025-07-30T07:56:06.098655,people,[],6,1,0
sea level,It is about 2400 feet above sea level and 500 feet from Islamabad city.,noun_phrase,English,Islamabad,nan,nan,https://travelpakistani.com/blogs/top-10-most-beautiful-places-in-islamabad-2024/125,"[73.0479, 33.6844]",2025-07-30T07:56:06.098655,sea level,[],9,2,0
3 thousand visitors,It can accommodate 3 thousand visitors all at once.,noun_phrase,English,Islamabad,nan,nan,https://travelpakistani.com/blogs/top-10-most-beautiful-places-in-islamabad-2024/125,"[73.0479, 33.6844]",2025-07-30T07:56:06.098655,thousand visitor,[],16,2,0
UNESCO,"Working with UNESCO, this museum has well-kept maintenance while preserving the organization’s donated artifacts.",noun_phrase,English,Islamabad,nan,nan,https://travelpakistani.com/blogs/top-10-most-beautiful-places-in-islamabad-2024/125,"[73.0479, 33.6844]",2025-07-30T07:56:06.098655,unesco,[],6,1,0
Saidpur,"Saidpur has once been a Hindu village for some time now, where Hindu adorers gather to worship from far-off places.",noun_phrase,English,Islamabad,nan,nan,https://travelpakistani.com/blogs/top-10-most-beautiful-places-in-islamabad-2024/125,"[73.0479, 33.6844]",2025-07-30T07:56:06.098655,saidpur,[],7,1,0
The vestiges,The vestiges of the settlement continue to be seen by visitors.,noun_phrase,English,Islamabad,nan,nan,https://travelpakistani.com/blogs/top-10-most-beautiful-places-in-islamabad-2024/125,"[73.0479, 33.6844]",2025-07-30T07:56:06.098655,vestige,[],7,1,0
This monument,This monument symbolizes the togetherness of the people of Pakistan who have sacrificed their “today” on behalf of a brighter “future.”,noun_phrase,English,Islamabad,nan,nan,https://travelpakistani.com/blogs/top-10-most-beautiful-places-in-islamabad-2024/125,"[73.0479, 33.6844]",2025-07-30T07:56:06.098655,monument,[],8,1,0
This cave,This cave is also called the Budhha cave.,noun_phrase,English,Islamabad,nan,nan,https://travelpakistani.com/blogs/top-10-most-beautiful-places-in-islamabad-2024/125,"[73.0479, 33.6844]",2025-07-30T07:56:06.098655,cave,[],4,1,0
a well,There is a well and a mosque built by Shahabuddin Ghauri on an hour's hike from this place.,noun_phrase,English,Islamabad,nan,nan,https://travelpakistani.com/blogs/top-10-most-beautiful-places-in-islamabad-2024/125,"[73.0479, 33.6844]",2025-07-30T07:56:06.098655,well,[],4,1,0
Lakeview Park,Lakeview Park is located at the bank of Rawal Lake.,noun_phrase,English,Islamabad,nan,nan,https://travelpakistani.com/blogs/top-10-most-beautiful-places-in-islamabad-2024/125,"[73.0479, 33.6844]",2025-07-30T07:56:06.098655,lakeview park,[],13,2,0
a swimming pool,"It has a swimming pool, boating arena, horse riding mobs, a fishing area, and paintball fields.",noun_phrase,English,Islamabad,nan,nan,https://travelpakistani.com/blogs/top-10-most-beautiful-places-in-islamabad-2024/125,"[73.0479, 33.6844]",2025-07-30T07:56:06.098655,swimming pool,[],13,2,0
Margalla Hills,Margalla Hills are the desired destinations for rock climbers.,noun_phrase,English,Islamabad,nan,nan,https://travelpakistani.com/blogs/top-10-most-beautiful-places-in-islamabad-2024/125,"[73.0479, 33.6844]",2025-07-30T07:56:06.098655,margalla hill,[],13,2,0
Ayub,Ayub National Park or Ayub Park is historically known as ‘Topi Rakh’.,noun_phrase,English,Islamabad,nan,nan,https://travelpakistani.com/blogs/top-10-most-beautiful-places-in-islamabad-2024/125,"[73.0479, 33.6844]",2025-07-30T07:56:06.098655,ayub,[],4,1,0
A lot,A lot of attractions for both kids and adults are provided in the park.,noun_phrase,English,Islamabad,nan,nan,https://travelpakistani.com/blogs/top-10-most-beautiful-places-in-islamabad-2024/125,"[73.0479, 33.6844]",2025-07-30T07:56:06.098655,lot,[],3,1,0
These areas,"These areas are landscaped to the preferences of the species including lions, zebras, peacocks, swans turkeys, etc.",noun_phrase,English,Islamabad,nan,nan,https://travelpakistani.com/blogs/top-10-most-beautiful-places-in-islamabad-2024/125,"[73.0479, 33.6844]",2025-07-30T07:56:06.098655,area,[],4,1,0
a replica,"It is a replica of Mount Rushmore, South Dakota in the United States.",noun_phrase,English,Islamabad,nan,nan,https://travelpakistani.com/blogs/top-10-most-beautiful-places-in-islamabad-2024/125,"[73.0479, 33.6844]",2025-07-30T07:56:06.098655,replica,[],7,1,0
Home › Destinations ›,Home › Destinations › Asia › South Asia › Pakistan ›,noun_phrase,English,Islamabad,nan,nan,https://www.bucketlistly.blog/posts/6-best-places-visit-things-to-do-islamabad-pakistan,"[73.0479, 33.6844]",2025-07-30T07:56:06.099655,home destination,[],16,2,0
a complete Pakistan itinerary,Looking for a complete Pakistan itinerary?,noun_phrase,English,Islamabad,nan,nan,https://www.bucketlistly.blog/posts/6-best-places-visit-things-to-do-islamabad-pakistan,"[73.0479, 33.6844]",2025-07-30T07:56:06.099655,complete pakistan itinerary,['complete_pakistan'],27,3,1
One Month Travel Itinerary,One Month Travel Itinerary for Pakistan Islamabad Itinerary Map Where to Stay in Islamabad?,noun_phrase,English,Islamabad,nan,nan,https://www.bucketlistly.blog/posts/6-best-places-visit-things-to-do-islamabad-pakistan,"[73.0479, 33.6844]",2025-07-30T07:56:06.099655,one month travel itinerary,[],26,4,0
the symmetry,Admire the symmetry of the Pakistan Monument 2.,noun_phrase,English,Islamabad,nan,nan,https://www.bucketlistly.blog/posts/6-best-places-visit-things-to-do-islamabad-pakistan,"[73.0479, 33.6844]",2025-07-30T07:56:06.099655,symmetry,[],8,1,0
the Lok Virsa Museum,Visit the Lok Virsa Museum 3.,noun_phrase,English,Islamabad,nan,nan,https://www.bucketlistly.blog/posts/6-best-places-visit-things-to-do-islamabad-pakistan,"[73.0479, 33.6844]",2025-07-30T07:56:06.099655,lok virsa museum,[],16,3,0
your way,Eat your way through Centaurus Mall's Food Court 4.,noun_phrase,English,Islamabad,nan,nan,https://www.bucketlistly.blog/posts/6-best-places-visit-things-to-do-islamabad-pakistan,"[73.0479, 33.6844]",2025-07-30T07:56:06.099655,way,[],3,1,0
the Daman-e-Koh Viewpoint,Check out the Daman-e-Koh Viewpoint 5.,noun_phrase,English,Islamabad,nan,nan,https://www.bucketlistly.blog/posts/6-best-places-visit-things-to-do-islamabad-pakistan,"[73.0479, 33.6844]",2025-07-30T07:56:06.099655,daman-e-koh viewpoint,['daman-e-koh_viewpoint'],21,2,1
Dine,"Dine with a View at Monal Restaurant, Pir Sohawa 6. Visit the Faisal Mosque during Sunset 1.",noun_phrase,English,Islamabad,nan,nan,https://www.bucketlistly.blog/posts/6-best-places-visit-things-to-do-islamabad-pakistan,"[73.0479, 33.6844]",2025-07-30T07:56:06.099655,dine,[],4,1,0
Which tourist SIM card,Which tourist SIM card is best for Pakistan?,noun_phrase,English,Islamabad,nan,nan,https://www.bucketlistly.blog/posts/6-best-places-visit-things-to-do-islamabad-pakistan,"[73.0479, 33.6844]",2025-07-30T07:56:06.099655,tourist sim card,[],16,3,0
Pakistan Islamabad Itinerary Map,Further Reading for Pakistan Islamabad Itinerary Map 6 Best Things to Do in Islamabad 1.,noun_phrase,English,Islamabad,nan,nan,https://www.bucketlistly.blog/posts/6-best-places-visit-things-to-do-islamabad-pakistan,"[73.0479, 33.6844]",2025-07-30T07:56:06.099655,pakistan islamabad itinerary map,['itinerary_map'],32,4,1
More Hotels,View More Hotels 2.,noun_phrase,English,Islamabad,nan,nan,https://www.bucketlistly.blog/posts/6-best-places-visit-things-to-do-islamabad-pakistan,"[73.0479, 33.6844]",2025-07-30T07:56:06.099655,hotel,[],5,1,0
Backpackers Hostel,Backpackers Hostel and Guesthouse Islamabad (Budget),noun_phrase,English,Islamabad,nan,nan,https://www.bucketlistly.blog/posts/6-best-places-visit-things-to-do-islamabad-pakistan,"[73.0479, 33.6844]",2025-07-30T07:56:06.099655,backpacker hostel,[],17,2,0
Jasmine Inn,Jasmine Inn (Mid-Range) 👍,noun_phrase,English,Islamabad,nan,nan,https://www.bucketlistly.blog/posts/6-best-places-visit-things-to-do-islamabad-pakistan,"[73.0479, 33.6844]",2025-07-30T07:56:06.099655,jasmine inn,[],11,2,0
Top Pick Islamabad Serena Hotel,Top Pick Islamabad Serena Hotel (High-End) From Islamabad:,noun_phrase,English,Islamabad,nan,nan,https://www.bucketlistly.blog/posts/6-best-places-visit-things-to-do-islamabad-pakistan,"[73.0479, 33.6844]",2025-07-30T07:56:06.099655,top pick islamabad serena hotel,"['top_pick', 'serena_hotel']",31,5,2
Full Day Historical Peshawar Guided City Tour,Full Day Historical Peshawar Guided City Tour (8 to 10 hours) Full-Day Sightseeing Tour Of Islamabad (5 to 6 hours) Islamabad International Airport Arrival Pick up Transfer (1 hour) 3. Eat your way through Centaurus Mall's Food Court 🥘,noun_phrase,English,Islamabad,nan,nan,https://www.bucketlistly.blog/posts/6-best-places-visit-things-to-do-islamabad-pakistan,"[73.0479, 33.6844]",2025-07-30T07:56:06.099655,full day historical peshawar guided city tour,"['full_day', 'historical_peshawar']",45,7,2
The structure,"The structure turned orange, and the prayer call echoed throughout the city.",noun_phrase,English,Islamabad,nan,nan,https://www.bucketlistly.blog/posts/6-best-places-visit-things-to-do-islamabad-pakistan,"[73.0479, 33.6844]",2025-07-30T07:56:06.100656,structure,[],9,1,0
Pakistan Travel Video,Pakistan Travel Video Watch it on Youtube When to Go to Islamabad?,noun_phrase,English,Islamabad,nan,nan,https://www.bucketlistly.blog/posts/6-best-places-visit-things-to-do-islamabad-pakistan,"[73.0479, 33.6844]",2025-07-30T07:56:06.100656,pakistan travel video,[],21,3,0
around $30 - $50 USD,"Expect to spend around $30 - $50 USD per day per person, which includes both accommodation and meals.",noun_phrase,English,Islamabad,nan,nan,https://www.bucketlistly.blog/posts/6-best-places-visit-things-to-do-islamabad-pakistan,"[73.0479, 33.6844]",2025-07-30T07:56:06.100656,usd,[],3,1,0
Reliable WiFi,"Reliable WiFi is not easy to come by, so I would recommend that you get a SIM card instead.",noun_phrase,English,Islamabad,nan,nan,https://www.bucketlistly.blog/posts/6-best-places-visit-things-to-do-islamabad-pakistan,"[73.0479, 33.6844]",2025-07-30T07:56:06.100656,reliable wifi,['reliable_wifi'],13,2,1
order,"In order to get a SIM card in Islamabad, you will need to find a franchise office of a carrier you want that will issue a SIM card to foreigners.",noun_phrase,English,Islamabad,nan,nan,https://www.bucketlistly.blog/posts/6-best-places-visit-things-to-do-islamabad-pakistan,"[73.0479, 33.6844]",2025-07-30T07:56:06.100656,order,[],5,1,0
a SIM card,DO NOT get a SIM card at the airport.,noun_phrase,English,Islamabad,nan,nan,https://www.bucketlistly.blog/posts/6-best-places-visit-things-to-do-islamabad-pakistan,"[73.0479, 33.6844]",2025-07-30T07:56:06.100656,sim card,['sim_card'],8,2,1
Zong,"I personally used Zong when I was there, and I had signals most of the time in the north, except in Fairy Meadows.",noun_phrase,English,Islamabad,nan,nan,https://www.bucketlistly.blog/posts/6-best-places-visit-things-to-do-islamabad-pakistan,"[73.0479, 33.6844]",2025-07-30T07:56:06.100656,zong,[],4,1,0
the one,"I would recommend the one with calls if you are planning to go up north as the data connection becomes unreliable up there, and you might need to call some places to book.",noun_phrase,English,Islamabad,nan,nan,https://www.bucketlistly.blog/posts/6-best-places-visit-things-to-do-islamabad-pakistan,"[73.0479, 33.6844]",2025-07-30T07:56:06.100656,one,[],3,1,0
the Columbia Steens Mountain Fleece,I recommend the Columbia Steens Mountain Fleece ( for women ).,noun_phrase,English,Islamabad,nan,nan,https://www.bucketlistly.blog/posts/6-best-places-visit-things-to-do-islamabad-pakistan,"[73.0479, 33.6844]",2025-07-30T07:56:06.100656,columbia steen mountain fleece,[],30,4,0
the Columbia Watertight Jacket,I highly recommend the Columbia Watertight Jacket ( for women ).,noun_phrase,English,Islamabad,nan,nan,https://www.bucketlistly.blog/posts/6-best-places-visit-things-to-do-islamabad-pakistan,"[73.0479, 33.6844]",2025-07-30T07:56:06.100656,columbia watertight jacket,[],26,3,0
the Sony a7R V camera,"I recommend the Sony a7R V camera together with the Sony 24-70mm f2.8 GM II lens , which is probably the highest-performance camera and lens combination you can get right now.",noun_phrase,English,Islamabad,nan,nan,https://www.bucketlistly.blog/posts/6-best-places-visit-things-to-do-islamabad-pakistan,"[73.0479, 33.6844]",2025-07-30T07:56:06.100656,sony a7r camera,[],15,3,0
Power Bank,"Power Bank : Keep your electronics charged on the go with a 20,000+ mAh Power Bank .",noun_phrase,English,Islamabad,nan,nan,https://www.bucketlistly.blog/posts/6-best-places-visit-things-to-do-islamabad-pakistan,"[73.0479, 33.6844]",2025-07-30T07:56:06.100656,power bank,[],10,2,0
Water Bottle,Water Bottle : The Hydro Flask Trail Water Bottle is a great insulated water bottle to have with you in cities or on hiking trails.,noun_phrase,English,Islamabad,nan,nan,https://www.bucketlistly.blog/posts/6-best-places-visit-things-to-do-islamabad-pakistan,"[73.0479, 33.6844]",2025-07-30T07:56:06.100656,water bottle,[],12,2,0
your water,It is lightweight and can keep your water cold or warm for more than 12 hours.,noun_phrase,English,Islamabad,nan,nan,https://www.bucketlistly.blog/posts/6-best-places-visit-things-to-do-islamabad-pakistan,"[73.0479, 33.6844]",2025-07-30T07:56:06.100656,water,[],5,1,0
Packing Cubes,Packing Cubes : Packing Cubes will help you save space in your backpack and keep all your belongings organized.,noun_phrase,English,Islamabad,nan,nan,https://www.bucketlistly.blog/posts/6-best-places-visit-things-to-do-islamabad-pakistan,"[73.0479, 33.6844]",2025-07-30T07:56:06.100656,packing cube,[],12,2,0
all my travel gear,"It's large enough to carry all my travel gear, and it comes with plenty of slots and pouches.",noun_phrase,English,Islamabad,nan,nan,https://www.bucketlistly.blog/posts/6-best-places-visit-things-to-do-islamabad-pakistan,"[73.0479, 33.6844]",2025-07-30T07:56:06.100656,travel gear,[],11,2,0
hell,"Plus, it's stylish as hell!",noun_phrase,English,Islamabad,nan,nan,https://www.bucketlistly.blog/posts/6-best-places-visit-things-to-do-islamabad-pakistan,"[73.0479, 33.6844]",2025-07-30T07:56:06.100656,hell,[],4,1,0
the Osprey Atmos AG,I recommend the Osprey Atmos AG 65L backpack .,noun_phrase,English,Islamabad,nan,nan,https://www.bucketlistly.blog/posts/6-best-places-visit-things-to-do-islamabad-pakistan,"[73.0479, 33.6844]",2025-07-30T07:56:06.100656,osprey atmos,['atmos_ag'],12,2,1
Use Uber,Use Uber all the way.,noun_phrase,English,Islamabad,nan,nan,https://www.bucketlistly.blog/posts/6-best-places-visit-things-to-do-islamabad-pakistan,"[73.0479, 33.6844]",2025-07-30T07:56:06.100656,use uber,[],8,2,0
One caveat,"One caveat with using Uber to go to Daman-e-Koh and Pir Sohawa viewpoints is that there is no connection on that hill, and Uber might continue to bill you until your connection is restored.",noun_phrase,English,Islamabad,nan,nan,https://www.bucketlistly.blog/posts/6-best-places-visit-things-to-do-islamabad-pakistan,"[73.0479, 33.6844]",2025-07-30T07:56:06.100656,one caveat,[],10,2,0
your driver,"So, it would be best to negotiate with your driver to wait for you and take you down as well, so there are no surprise charges to your credit card.",noun_phrase,English,Islamabad,nan,nan,https://www.bucketlistly.blog/posts/6-best-places-visit-things-to-do-islamabad-pakistan,"[73.0479, 33.6844]",2025-07-30T07:56:06.100656,driver,[],6,1,0
some resources,Here are some resources to help you get going:,noun_phrase,English,Islamabad,nan,nan,https://www.bucketlistly.blog/posts/6-best-places-visit-things-to-do-islamabad-pakistan,"[73.0479, 33.6844]",2025-07-30T07:56:06.101655,resource,[],8,1,0
Pakistan,Further Reading for Pakistan I hope this guide will help you plan your trip to Pakistan.,noun_phrase,English,Islamabad,nan,nan,https://www.bucketlistly.blog/posts/6-best-places-visit-things-to-do-islamabad-pakistan,"[73.0479, 33.6844]",2025-07-30T07:56:06.101655,pakistan,[],8,1,0
the Golden Triangle,"How about exploring the Golden Triangle in India , doing some trekking in Nepal , or going off-the-beaten-path and exploring Sri Lanka by train ?",noun_phrase,English,Islamabad,nan,nan,https://www.bucketlistly.blog/posts/6-best-places-visit-things-to-do-islamabad-pakistan,"[73.0479, 33.6844]",2025-07-30T07:56:06.101655,golden triangle,['golden_triangle'],15,2,1
my travel guides,"For more of my travel guides, visit my Destinations page.",noun_phrase,English,Islamabad,nan,nan,https://www.bucketlistly.blog/posts/6-best-places-visit-things-to-do-islamabad-pakistan,"[73.0479, 33.6844]",2025-07-30T07:56:06.101655,travel guide,[],12,2,0
Disclosure,Disclosure: This post may contain affiliate links .,noun_phrase,English,Islamabad,nan,nan,https://www.bucketlistly.blog/posts/6-best-places-visit-things-to-do-islamabad-pakistan,"[73.0479, 33.6844]",2025-07-30T07:56:06.101655,disclosure,[],10,1,0
Categories Destinations Pakistan Asia South Asia,Categories Destinations Pakistan Asia South Asia More Pakistan 8 Comments Love this post.,noun_phrase,English,Islamabad,nan,nan,https://www.bucketlistly.blog/posts/6-best-places-visit-things-to-do-islamabad-pakistan,"[73.0479, 33.6844]",2025-07-30T07:56:06.101655,category destination pakistan asia south asia,[],45,6,0
Well all your travels,Well all your travels in general.,noun_phrase,English,Islamabad,nan,nan,https://www.bucketlistly.blog/posts/6-best-places-visit-things-to-do-islamabad-pakistan,"[73.0479, 33.6844]",2025-07-30T07:56:06.101655,well travel,[],11,2,0
the sims,Good to know about the sims.,noun_phrase,English,Islamabad,nan,nan,https://www.bucketlistly.blog/posts/6-best-places-visit-things-to-do-islamabad-pakistan,"[73.0479, 33.6844]",2025-07-30T07:56:06.101655,sims,[],4,1,0
Your blog,"Hi, Your blog was very informative and enjoyable to read.",noun_phrase,English,Islamabad,nan,nan,https://www.bucketlistly.blog/posts/6-best-places-visit-things-to-do-islamabad-pakistan,"[73.0479, 33.6844]",2025-07-30T07:56:06.101655,blog,[],4,1,0
the climate,"Other than that, the climate in the south will be perfect so you can also go explore the south instead.",noun_phrase,English,Islamabad,nan,nan,https://www.bucketlistly.blog/posts/6-best-places-visit-things-to-do-islamabad-pakistan,"[73.0479, 33.6844]",2025-07-30T07:56:06.101655,climate,[],7,1,0
Patriot.,"I,ll happy for hosting..... Patriot.❤️❤️❤️👍👍",noun_phrase,English,Islamabad,nan,nan,https://www.bucketlistly.blog/posts/6-best-places-visit-things-to-do-islamabad-pakistan,"[73.0479, 33.6844]",2025-07-30T07:56:06.101655,patriot,[],7,1,0
Baltistan Hunza,Home Destinations Gilgit-Baltistan Hunza Khyber Pakhtunkhwa Punjab Lahore Sindh Karachi Azad Kashmir Balochistan Gilgit-Baltistan Hunza Hunza Khyber Pakhtunkhwa Punjab,noun_phrase,English,Islamabad,nan,nan,https://www.pakistantravelblog.com/top-6-tourist-attractions-near-islamabad/,"[73.0479, 33.6844]",2025-07-30T07:56:06.101655,baltistan hunza,[],15,2,0
