description,sentence_context,phrase_type,language,location,osm_tag_key,osm_tag_value,source,coordinates,extracted_at,cleaned_description,adjective_noun_patterns,description_length,word_count,pattern_count
orange color,"It's lightweight, breathable, and even comes in a cool orange color.",adjective_noun,English,Islamabad,nan,nan,https://www.bucketlistly.blog/posts/6-best-places-visit-things-to-do-islamabad-pakistan,"[73.0479, 33.6844]",2025-07-30T07:56:06.095655,orange color,[],12,2,0
the ideal backpacker,"Microfiber Towel : A Microfiber towel is the ideal backpacker's towel due to its lightness, quick drying, and compressibility.",adjective_noun,English,Islamabad,nan,nan,https://www.bucketlistly.blog/posts/6-best-places-visit-things-to-do-islamabad-pakistan,"[73.0479, 33.6844]",2025-07-30T07:56:06.095655,ideal backpacker,[],16,2,0
a good camera,You should also pack a good camera for your trip so that you can capture all the beautiful experiences you might have.,adjective_noun,English,Islamabad,nan,nan,https://www.bucketlistly.blog/posts/6-best-places-visit-things-to-do-islamabad-pakistan,"[73.0479, 33.6844]",2025-07-30T07:56:06.095655,good camera,['good_camera'],11,2,1
a total game,It's a total game-changer.,adjective_noun,English,Islamabad,nan,nan,https://www.bucketlistly.blog/posts/6-best-places-visit-things-to-do-islamabad-pakistan,"[73.0479, 33.6844]",2025-07-30T07:56:06.095655,total game,['total_game'],10,2,1
universal adapter,Universal Adapter : You'll need just one universal adapter to plug in your electronics in any country you visit.,adjective_noun,English,Islamabad,nan,nan,https://www.bucketlistly.blog/posts/6-best-places-visit-things-to-do-islamabad-pakistan,"[73.0479, 33.6844]",2025-07-30T07:56:06.095655,universal adapter,['universal_adapter'],17,2,1
everyday camera,Daypack : The Langly Alpha Globetrotter is my go-to everyday camera backpack.,adjective_noun,English,Islamabad,nan,nan,https://www.bucketlistly.blog/posts/6-best-places-visit-things-to-do-islamabad-pakistan,"[73.0479, 33.6844]",2025-07-30T07:56:06.095655,everyday camera,['everyday_camera'],15,2,1
a large backpack,Large Backpack : You will need a large backpack to carry all of your stuff.,adjective_noun,English,Islamabad,nan,nan,https://www.bucketlistly.blog/posts/6-best-places-visit-things-to-do-islamabad-pakistan,"[73.0479, 33.6844]",2025-07-30T07:56:06.095655,large backpack,['large_backpack'],14,2,1
excellent weight,"With excellent weight distribution and a lifetime guarantee, you can't go wrong with Osprey.",adjective_noun,English,Islamabad,nan,nan,https://www.bucketlistly.blog/posts/6-best-places-visit-things-to-do-islamabad-pakistan,"[73.0479, 33.6844]",2025-07-30T07:56:06.095655,excellent weight,['excellent_weight'],16,2,1
more information,"For more information on what I pack in my backpack for this trip, check out: My Packing List: 60 Travel Essentials .",adjective_noun,English,Islamabad,nan,nan,https://www.bucketlistly.blog/posts/6-best-places-visit-things-to-do-islamabad-pakistan,"[73.0479, 33.6844]",2025-07-30T07:56:06.095655,information,[],11,1,0
new airport,"You can fly straight to Islamabad's new airport from the US via Middle Eastern airlines such as Etihad, Qatar, or Turkish Airlines.",adjective_noun,English,Islamabad,nan,nan,https://www.bucketlistly.blog/posts/6-best-places-visit-things-to-do-islamabad-pakistan,"[73.0479, 33.6844]",2025-07-30T07:56:06.095655,new airport,['new_airport'],11,2,1
great options,"If you are coming from the east, Thai and Air China are also great options.",adjective_noun,English,Islamabad,nan,nan,https://www.bucketlistly.blog/posts/6-best-places-visit-things-to-do-islamabad-pakistan,"[73.0479, 33.6844]",2025-07-30T07:56:06.095655,great option,['great_options'],12,2,1
cheapest flights,"I often use Expedia or Skyscanner to find the fastest and cheapest flights for my trips around the world, so feel free to browse through some of the deals they have there.",adjective_noun,English,Islamabad,nan,nan,https://www.bucketlistly.blog/posts/6-best-places-visit-things-to-do-islamabad-pakistan,"[73.0479, 33.6844]",2025-07-30T07:56:06.095655,cheapest flight,['cheapest_flights'],15,2,1
fewer headaches,"It is cheaper, with fewer headaches, and it takes you where you want to go.",adjective_noun,English,Islamabad,nan,nan,https://www.bucketlistly.blog/posts/6-best-places-visit-things-to-do-islamabad-pakistan,"[73.0479, 33.6844]",2025-07-30T07:56:06.095655,fewer headache,['fewer_headaches'],14,2,1
more articles,"I have written tons more articles about Pakistan, and here's a selection of them to help you further plan your Pakistan trip: Looking for a complete itinerary and travel guide for Pakistan?",adjective_noun,English,Islamabad,nan,nan,https://www.bucketlistly.blog/posts/6-best-places-visit-things-to-do-islamabad-pakistan,"[73.0479, 33.6844]",2025-07-30T07:56:06.095655,article,[],7,1,0
a complete travel,Here's a complete travel guide and a 2-week itinerary for traveling the Karakoram Highway .,adjective_noun,English,Islamabad,nan,nan,https://www.bucketlistly.blog/posts/6-best-places-visit-things-to-do-islamabad-pakistan,"[73.0479, 33.6844]",2025-07-30T07:56:06.095655,complete travel,['complete_travel'],15,2,1
a beautiful city,"Lahore is a beautiful city, full of stunning Mughal and British architectures that have stood the test of time.",adjective_noun,English,Islamabad,nan,nan,https://www.bucketlistly.blog/posts/6-best-places-visit-things-to-do-islamabad-pakistan,"[73.0479, 33.6844]",2025-07-30T07:56:06.095655,beautiful city,['beautiful_city'],14,2,1
highest mountain,"Fairy Meadows and Nanga Parbat, the 8th highest mountain in the world, are probably the most accessible 8000+ mountains out there.",adjective_noun,English,Islamabad,nan,nan,https://www.bucketlistly.blog/posts/6-best-places-visit-things-to-do-islamabad-pakistan,"[73.0479, 33.6844]",2025-07-30T07:56:06.096655,highest mountain,['highest_mountain'],16,2,1
a complete hiking,Here's a complete hiking guide to Fairy Meadows and Nanga Parbat Base Camp .,adjective_noun,English,Islamabad,nan,nan,https://www.bucketlistly.blog/posts/6-best-places-visit-things-to-do-islamabad-pakistan,"[73.0479, 33.6844]",2025-07-30T07:56:06.096655,complete hiking,['complete_hiking'],15,2,1
Another great hike,Another great hike you can do is the Rakaposhi Base Camp hike that will take you up atop the Nagar Valley with an unbeatable view of the Minapin Glacier.,adjective_noun,English,Islamabad,nan,nan,https://www.bucketlistly.blog/posts/6-best-places-visit-things-to-do-islamabad-pakistan,"[73.0479, 33.6844]",2025-07-30T07:56:06.096655,another great hike,['great_hike'],18,3,1
beautiful valleys,The Hunza Valley is one of the most beautiful valleys in Pakistan.,adjective_noun,English,Islamabad,nan,nan,https://www.bucketlistly.blog/posts/6-best-places-visit-things-to-do-islamabad-pakistan,"[73.0479, 33.6844]",2025-07-30T07:56:06.096655,beautiful valley,['beautiful_valleys'],16,2,1
a perfect base,"The capital city of the Hunza Valley is Karimabad, which is a perfect base for you to explore the Valley.",adjective_noun,English,Islamabad,nan,nan,https://www.bucketlistly.blog/posts/6-best-places-visit-things-to-do-islamabad-pakistan,"[73.0479, 33.6844]",2025-07-30T07:56:06.096655,perfect base,['perfect_base'],12,2,1
awesome things,"Here’s 5 awesome things to do in Karimabad, Hunza Valley .",adjective_noun,English,Islamabad,nan,nan,https://www.bucketlistly.blog/posts/6-best-places-visit-things-to-do-islamabad-pakistan,"[73.0479, 33.6844]",2025-07-30T07:56:06.096655,awesome thing,['awesome_things'],13,2,1
more travel,Looking for more travel guides for South Asia?,adjective_noun,English,Islamabad,nan,nan,https://www.bucketlistly.blog/posts/6-best-places-visit-things-to-do-islamabad-pakistan,"[73.0479, 33.6844]",2025-07-30T07:56:06.096655,travel,[],6,1,0
handy info,Always handy info.,adjective_noun,English,Islamabad,nan,nan,https://www.bucketlistly.blog/posts/6-best-places-visit-things-to-do-islamabad-pakistan,"[73.0479, 33.6844]",2025-07-30T07:56:06.096655,handy info,['handy_info'],10,2,1
a great country,Pakistan is a great country to travel in for sure!,adjective_noun,English,Islamabad,nan,nan,https://www.bucketlistly.blog/posts/6-best-places-visit-things-to-do-islamabad-pakistan,"[73.0479, 33.6844]",2025-07-30T07:56:06.096655,great country,['great_country'],13,2,1
the first time,I'm heading back to Pakistan in December this year for the first time since leaving when I was 5.,adjective_noun,English,Islamabad,nan,nan,https://www.bucketlistly.blog/posts/6-best-places-visit-things-to-do-islamabad-pakistan,"[73.0479, 33.6844]",2025-07-30T07:56:06.096655,first time,['first_time'],10,2,1
a good idea,Can I please ask you if it's a good idea to get a tour guide and if its worth heading up north to see the snow?,adjective_noun,English,Islamabad,nan,nan,https://www.bucketlistly.blog/posts/6-best-places-visit-things-to-do-islamabad-pakistan,"[73.0479, 33.6844]",2025-07-30T07:56:06.096655,good idea,['good_idea'],9,2,1
a wonderful country,Pakistan sure is a wonderful country to travel through especially in the north.,adjective_noun,English,Islamabad,nan,nan,https://www.bucketlistly.blog/posts/6-best-places-visit-things-to-do-islamabad-pakistan,"[73.0479, 33.6844]",2025-07-30T07:56:06.096655,wonderful country,['wonderful_country'],17,2,1
remote places,"It would definitely be easier if you have a driver to drive you around with a jeep, which will save you a lot time and allow you to see more remote places although it will be quite cold in December and Khunjerab pass will definitely be closed during that time.",adjective_noun,English,Islamabad,nan,nan,https://www.bucketlistly.blog/posts/6-best-places-visit-things-to-do-islamabad-pakistan,"[73.0479, 33.6844]",2025-07-30T07:56:06.096655,remote place,['remote_places'],12,2,1
Nice article,Nice article.,adjective_noun,English,Islamabad,nan,nan,https://www.bucketlistly.blog/posts/6-best-places-visit-things-to-do-islamabad-pakistan,"[73.0479, 33.6844]",2025-07-30T07:56:06.096655,nice article,['nice_article'],12,2,1
northern areas,"Lahore Lahore Sindh Karachi Karachi Azad Kashmir Balochistan Travel Tips Travel Tips Dos and Don’ts Solo Female Travel Travel Safety Tips What To Wear Travel Tips Dos and Don’ts Solo Female Travel Travel Safety Tips What To Wear Travel Guide Travel Guide Food Guide Visa Guide Visa to Pakistan Visa from Pakistan Itineraries Travel Guide Food Guide Visa Guide Visa to Pakistan Visa from Pakistan Visa to Pakistan Visa from Pakistan Itineraries Travel Resources Books Emergency Resources Legal Guide Books News Books Emergency Resources Legal Guide Books News Reviews Trip Reports Food Reviews Trip Reports Food Reviews Store Pakistan’s capital, Islamabad, is the gateway to the famed northern areas of Pakistan, where both locals and visitors like to unwind over the weekend.",adjective_noun,English,Islamabad,nan,nan,https://www.pakistantravelblog.com/top-6-tourist-attractions-near-islamabad/,"[73.0479, 33.6844]",2025-07-30T07:56:06.096655,northern area,['northern_areas'],13,2,1
old counterparts,"It is younger than its centuries-old counterparts, covers less area and has a relatively smaller population.",adjective_noun,English,Islamabad,nan,nan,https://www.pakistantravelblog.com/top-6-tourist-attractions-near-islamabad/,"[73.0479, 33.6844]",2025-07-30T07:56:06.096655,old counterpart,['old_counterparts'],15,2,1
everyday routine,"Sometimes, the drudgery of everyday routine can sneak up on you.",adjective_noun,English,Islamabad,nan,nan,https://www.pakistantravelblog.com/top-6-tourist-attractions-near-islamabad/,"[73.0479, 33.6844]",2025-07-30T07:56:06.096655,everyday routine,[],16,2,0
new setting,"Luckily, when that happens, you can find yourself in a completely new setting in just a few hours, enjoying stunning views while enjoying a hot cup of chai.",adjective_noun,English,Islamabad,nan,nan,https://www.pakistantravelblog.com/top-6-tourist-attractions-near-islamabad/,"[73.0479, 33.6844]",2025-07-30T07:56:06.096655,new setting,[],11,2,0
The green mountain,"The green mountain resort of Nathia Gali, approximately 2,410 metres above sea level, is a popular choice for a mini vacation.",adjective_noun,English,Islamabad,nan,nan,https://www.pakistantravelblog.com/top-6-tourist-attractions-near-islamabad/,"[73.0479, 33.6844]",2025-07-30T07:56:06.096655,green mountain,['green_mountain'],14,2,1
adventurous excursion,"Those who want a more adventurous excursion can trek up the Mukshpuri (also Mukeshpuri) and Miranjani hills, which peak at 2,800 and 2,992 metres respectively.",adjective_noun,English,Islamabad,nan,nan,https://www.pakistantravelblog.com/top-6-tourist-attractions-near-islamabad/,"[73.0479, 33.6844]",2025-07-30T07:56:06.096655,adventurous excursion,['adventurous_excursion'],21,2,1
private transportation,You can hire private transportation or hop on a Daewoo Express bus that runs every few hours from Rawalpindi (Islamabad’s twin city) to Murree.,adjective_noun,English,Islamabad,nan,nan,https://www.pakistantravelblog.com/top-6-tourist-attractions-near-islamabad/,"[73.0479, 33.6844]",2025-07-30T07:56:06.096655,private transportation,['private_transportation'],22,2,1
public transport,"Once in Murree, you will find plenty of public transport options to take you to Nathia Gali.",adjective_noun,English,Islamabad,nan,nan,https://www.pakistantravelblog.com/top-6-tourist-attractions-near-islamabad/,"[73.0479, 33.6844]",2025-07-30T07:56:06.096655,public transport,['public_transport'],16,2,1
Frequent visitors,Where to stay: Frequent visitors opt for either Hotel Amore or Hotel Elites.,adjective_noun,English,Islamabad,nan,nan,https://www.pakistantravelblog.com/top-6-tourist-attractions-near-islamabad/,"[73.0479, 33.6844]",2025-07-30T07:56:06.096655,frequent visitor,['frequent_visitors'],16,2,1
other features,"The rooms, meals, and other features in these hotels are generally better rated than many other options available in the vicinity.",adjective_noun,English,Islamabad,nan,nan,https://www.pakistantravelblog.com/top-6-tourist-attractions-near-islamabad/,"[73.0479, 33.6844]",2025-07-30T07:56:06.096655,feature,[],7,1,0
British troops,"For years and years, Murree – a sanatorium for British troops in the mid-1800s and early 1900s – has been the go-to hill station for people from all over the country.",adjective_noun,English,Islamabad,nan,nan,https://www.pakistantravelblog.com/top-6-tourist-attractions-near-islamabad/,"[73.0479, 33.6844]",2025-07-30T07:56:06.096655,british troop,['british_troops'],13,2,1
longer journeys,"While the novelty of the place has worn off considerably due to increasing commercialisation, Murree is still thronged by tourists as a transit station for longer journeys or a short stay in the quieter days of the year.",adjective_noun,English,Islamabad,nan,nan,https://www.pakistantravelblog.com/top-6-tourist-attractions-near-islamabad/,"[73.0479, 33.6844]",2025-07-30T07:56:06.096655,longer journey,['longer_journeys'],14,2,1
a sensible choice,"Where to stay: Arcadian Blue Pines Resort, located just outside Murree, is a sensible choice for those who wish to avoid the busy roads and the noise of the town.",adjective_noun,English,Islamabad,nan,nan,https://www.pakistantravelblog.com/top-6-tourist-attractions-near-islamabad/,"[73.0479, 33.6844]",2025-07-30T07:56:06.096655,sensible choice,['sensible_choice'],15,2,1
luxurious option,"A more luxurious option is Hotel One, and if you wish to have the Pearl Continental experience, PC Bhurban (close to Murree) is the place to stay.",adjective_noun,English,Islamabad,nan,nan,https://www.pakistantravelblog.com/top-6-tourist-attractions-near-islamabad/,"[73.0479, 33.6844]",2025-07-30T07:56:06.096655,luxurious option,['luxurious_option'],16,2,1
a top pick,"Ay 3: Thandiani For those looking to spend their weekend in a tranquil retreat that provides respite from the sweltering heat, Thandiani is a top pick.",adjective_noun,English,Islamabad,nan,nan,https://www.pakistantravelblog.com/top-6-tourist-attractions-near-islamabad/,"[73.0479, 33.6844]",2025-07-30T07:56:06.096655,top pick,['top_pick'],8,2,1
the perfect getaway,"The hill station, located in the foothills of the Himalayas at about 2,750 metres above sea level, is the perfect getaway if you’re willing to forego luxurious accommodation in favour of a calm environment and stunning surroundings.",adjective_noun,English,Islamabad,nan,nan,https://www.pakistantravelblog.com/top-6-tourist-attractions-near-islamabad/,"[73.0479, 33.6844]",2025-07-30T07:56:06.096655,perfect getaway,['perfect_getaway'],15,2,1
own car,"How to get there: Visitors usually prefer to travel in their own car, or rent a private vehicle from Islamabad, for the 3.5-hour drive via the Hazara Expressway.",adjective_noun,English,Islamabad,nan,nan,https://www.pakistantravelblog.com/top-6-tourist-attractions-near-islamabad/,"[73.0479, 33.6844]",2025-07-30T07:56:06.096655,car,[],3,1,0
The usual itinerary,The usual itinerary includes a lunch break in the city of Abbottabad before reaching Thandiani.,adjective_noun,English,Islamabad,nan,nan,https://www.pakistantravelblog.com/top-6-tourist-attractions-near-islamabad/,"[73.0479, 33.6844]",2025-07-30T07:56:06.096655,usual itinerary,['usual_itinerary'],15,2,1
green meadows,"Thandiani © Guy Teague 4: Siri Paye Meadows Lush green meadows at an elevation of 3,000 metres flanked by snow-capped mountain peaks, dotted with cattle under the watchful gaze of herdsmen, and adorned with a brilliant blue lake – this rustic wonder is called the Siri Paye Meadows.",adjective_noun,English,Islamabad,nan,nan,https://www.pakistantravelblog.com/top-6-tourist-attractions-near-islamabad/,"[73.0479, 33.6844]",2025-07-30T07:56:06.096655,green meadow,['green_meadows'],12,2,1
a proper road,"Because of the absence of a proper road leading up to it, this picturesque spot is relatively untouched.",adjective_noun,English,Islamabad,nan,nan,https://www.pakistantravelblog.com/top-6-tourist-attractions-near-islamabad/,"[73.0479, 33.6844]",2025-07-30T07:56:06.096655,proper road,['proper_road'],11,2,1
a great camping,"Adventure enthusiasts agree that in the summertime, the meadows offer a great camping experience.",adjective_noun,English,Islamabad,nan,nan,https://www.pakistantravelblog.com/top-6-tourist-attractions-near-islamabad/,"[73.0479, 33.6844]",2025-07-30T07:56:06.096655,great camping,['great_camping'],13,2,1
a rough track,"How to get there: Travellers coming from Islamabad will need to brave the five-hour drive via the Hazara Expressway or the N-35 to Shogran, from where jeeps can be rented to complete the remaining six-kilometre journey up a rough track.",adjective_noun,English,Islamabad,nan,nan,https://www.pakistantravelblog.com/top-6-tourist-attractions-near-islamabad/,"[73.0479, 33.6844]",2025-07-30T07:56:06.096655,rough track,['rough_track'],11,2,1
conventional lodgings,"Where to stay: If camping is not your cup of tea, make your way down to Shogran to spend the night in more conventional lodgings.",adjective_noun,English,Islamabad,nan,nan,https://www.pakistantravelblog.com/top-6-tourist-attractions-near-islamabad/,"[73.0479, 33.6844]",2025-07-30T07:56:06.096655,conventional lodging,['conventional_lodgings'],20,2,1
a comfortable stay,Visitors recommend Pine Park Shogran and the Arcadian Sprucewoods Resort for a comfortable stay.,adjective_noun,English,Islamabad,nan,nan,https://www.pakistantravelblog.com/top-6-tourist-attractions-near-islamabad/,"[73.0479, 33.6844]",2025-07-30T07:56:06.096655,comfortable stay,['comfortable_stay'],16,2,1
a popular choice,"Beautiful Siri Paye Meadows, Pakistan © Mina Tkla 5: Naran Despite gradually becoming overwhelmed with tourists and traffic (much like Murree), Naran remains a popular choice for a weekend getaway, mainly because of the magnificent Lake Saif-ul-Malook, River Kunhar’s delicious trout, rafting opportunities, camping by the riverside and hiking or trekking up different tracks.",adjective_noun,English,Islamabad,nan,nan,https://www.pakistantravelblog.com/top-6-tourist-attractions-near-islamabad/,"[73.0479, 33.6844]",2025-07-30T07:56:06.096655,popular choice,['popular_choice'],14,2,1
The same road,How to get there: The same road that leads to Shogran from Islamabad continues onward to Naran.,adjective_noun,English,Islamabad,nan,nan,https://www.pakistantravelblog.com/top-6-tourist-attractions-near-islamabad/,"[73.0479, 33.6844]",2025-07-30T07:56:06.096655,road,[],4,1,0
public transportation,"Although public transportation is available, travelling by private car is preferred so that you don’t have to keep rushing from one public vehicle to another in order to eventually reach Naran.",adjective_noun,English,Islamabad,nan,nan,https://www.pakistantravelblog.com/top-6-tourist-attractions-near-islamabad/,"[73.0479, 33.6844]",2025-07-30T07:56:06.096655,public transportation,['public_transportation'],21,2,1
standard rooms,The PTDC Motel Naran is a government-owned accommodation consisting of standard rooms as well as private huts.,adjective_noun,English,Islamabad,nan,nan,https://www.pakistantravelblog.com/top-6-tourist-attractions-near-islamabad/,"[73.0479, 33.6844]",2025-07-30T07:56:06.096655,standard room,[],13,2,0
few years,"In the last few years, the valley has gained repute as another major option for a long-weekend vacation in the mountains, with the added attraction of the fast flowing River Neelum.",adjective_noun,English,Islamabad,nan,nan,https://www.pakistantravelblog.com/top-6-tourist-attractions-near-islamabad/,"[73.0479, 33.6844]",2025-07-30T07:56:06.096655,year,[],4,1,0
no cellular network,"The destination is especially appealing to those who genuinely wish to disconnect from the world, as there is little to no cellular network coverage there.",adjective_noun,English,Islamabad,nan,nan,https://www.pakistantravelblog.com/top-6-tourist-attractions-near-islamabad/,"[73.0479, 33.6844]",2025-07-30T07:56:06.096655,cellular network,['cellular_network'],16,2,1
the Pakistani government,Foreigners require a No-Objection Certificate (NOC) from the Pakistani government to visit Neelum Valley.,adjective_noun,English,Islamabad,nan,nan,https://www.pakistantravelblog.com/top-6-tourist-attractions-near-islamabad/,"[73.0479, 33.6844]",2025-07-30T07:56:06.096655,pakistani government,['pakistani_government'],20,2,1
the first stop,"How to get there: From Murree, the first stop on the way to Neelum Valley is Muzaffarabad, which can be reached via the Murree-Kohala road.",adjective_noun,English,Islamabad,nan,nan,https://www.pakistantravelblog.com/top-6-tourist-attractions-near-islamabad/,"[73.0479, 33.6844]",2025-07-30T07:56:06.096655,first stop,['first_stop'],10,2,1
private transport,"From there it’s a 3.5-hour drive to the valley, for which private transport is highly recommended.",adjective_noun,English,Islamabad,nan,nan,https://www.pakistantravelblog.com/top-6-tourist-attractions-near-islamabad/,"[73.0479, 33.6844]",2025-07-30T07:56:06.096655,private transport,['private_transport'],17,2,1
personal preferences,"Where to stay: Neelum Valley has plenty of villages and towns to visit, depending on time availability and personal preferences.",adjective_noun,English,Islamabad,nan,nan,https://www.pakistantravelblog.com/top-6-tourist-attractions-near-islamabad/,"[73.0479, 33.6844]",2025-07-30T07:56:06.096655,personal preference,['personal_preferences'],19,2,1
the best option,Keran Guest House is the best option to stay in the Keran village if you want to be by the river.,adjective_noun,English,Islamabad,nan,nan,https://www.pakistantravelblog.com/top-6-tourist-attractions-near-islamabad/,"[73.0479, 33.6844]",2025-07-30T07:56:06.096655,best option,['best_option'],11,2,1
French cottages,"Alternatively, the Kutton Jagran Resort has French cottages that were originally constructed for Europeans who worked on the Jagran Hydropower Project around two decades ago.",adjective_noun,English,Islamabad,nan,nan,https://www.pakistantravelblog.com/top-6-tourist-attractions-near-islamabad/,"[73.0479, 33.6844]",2025-07-30T07:56:06.096655,french cottage,['french_cottages'],14,2,1
EN English FA Farsi AR Arabic Travel Guide,"EN English FA Farsi AR Arabic Travel Guide: Places To Visit in Islamabad and Things To Do Nov 12, 2019 Share Tweet Email Home Blog When it comes to travelling to Pakistan, visiting Islamabad is almost unavoidable, especially if you are flying into Pakistan.",noun_phrase,English,Islamabad,nan,nan,https://travelwithmansoureh.com/blog/travel-guide-places-to-visit-in-islamabad-and-things-to-do,"[73.0479, 33.6844]",2025-07-30T07:56:06.096655,english farsi arabic travel guide,['english_fa'],33,5,1
this reason,"For this reason, in this article, I will mainly focus on Islamabad.",noun_phrase,English,Islamabad,nan,nan,https://travelwithmansoureh.com/blog/travel-guide-places-to-visit-in-islamabad-and-things-to-do,"[73.0479, 33.6844]",2025-07-30T07:56:06.096655,reason,[],6,1,0
at least 2 or 3 days,It is worth spending at least 2 or 3 days in Islamabad to explore the city and its surroundings.,noun_phrase,English,Islamabad,nan,nan,https://travelwithmansoureh.com/blog/travel-guide-places-to-visit-in-islamabad-and-things-to-do,"[73.0479, 33.6844]",2025-07-30T07:56:06.096655,least day,[],9,2,0
our guide,This is our guide to Islamabad and things you should know before you visit.,noun_phrase,English,Islamabad,nan,nan,https://travelwithmansoureh.com/blog/travel-guide-places-to-visit-in-islamabad-and-things-to-do,"[73.0479, 33.6844]",2025-07-30T07:56:06.096655,guide,[],5,1,0
Islamabad,Islamabad can be very warm during the summers and humidity makes it feel even warmer.,noun_phrase,English,Islamabad,nan,nan,https://travelwithmansoureh.com/blog/travel-guide-places-to-visit-in-islamabad-and-things-to-do,"[73.0479, 33.6844]",2025-07-30T07:56:06.096655,islamabad,[],9,1,0
